,0,translate
1878,kartu pra kerja triliun tonton deh tuh video bayar ratusan ribu,pre-employment card trillion watch video deh tuh pay hundreds of thousands
1879,ceo portal berita gresnews agustinus edy mengungkap kejanggalan kelas online skill acade,ceo Augustine edy gresnews news portal online class skill uncover irregularities acade
1880,ya emang ga melanggar kalo sistemnya meloloskan wiraswasta trus kartunya trus,ya emang ga violated if the system passes the self-employed trus trus card
1881,kartu pra kerja perampokan uang negara terstruktur,card pre-work state funds structured robbery
1882,pemilihan peserta kartu pra kerja wewenang pemerintah jd mmg mas,the selection of a pre-employment card mmg mas jd government authority
1883,tka lulusan kartu pra kerja serius,tka graduate serious pre-employment card
1884,polemik kartu pra kerja wkwkwkw kisruh kelak menarik,pre-employment polemic wkwkwkw card draw chaotic future
1885,pelatihan kartu pra kerja penangguran gak ya,pre-employment training cards unemployment ya
1886,yg dipecat upah janji kartu pra kerja yg pengan,who fired a pre-employment wages card promises that pengan
1887,kartu kartu pra kerja uang dalamnya pelatihan membayar p,card card pre-employment training money it pays p
1888,bedanya program kartu pra kerja gratis ditawarkan coursera mohon dibaca s,the difference between a pre-employment program free cards offered Coursera please read s
1889,blk nya boss,blk nya boss
1890,juta buruh korban phk diikutkan program kartu pra kerja via,million workers dismissed victims included a pre-employment program via card
1891,sekinan problematika kartu pra kerja iki sumpah ngisin i padakke organisasi sekolah,Hekinan problematic card pre-employment was sworn embrace i liken school organization
1892,salah sistemnya emang random mas peserta pra kerja dipilih acak,one system weve mas random pre-work participants selected randomly
1893,sayang kartu pra kerja rakyat jelata kerja tka cina aja makan tuh karu,pre-employment card dear rabble tka work china aja tuh eat karu
1894,thread by melampaui batas kewarasan kesaksian peserta program kartu pra kerja yg,thread beyond the limits of sanity by the testimony of a pre-employment program participants reply card
1895,akal an bengkel gw berdoa ya allah laknatlah orang yg memakan uang disaat rakyat membu,sense an i pray ya allah workshop laknatlah person who takes the money when the people membu
1896,pengen menghujat kutahann puasaan kekonyolan ketidakbecusan pemerintah membuatku gak tahan n,puasaan silliness want to blaspheme kutahann government incompetence made me not resistant n
1897,baca ginian nyumpah nyumpahin org yg terlibat kartu pra kerja kzl,read ginian curse dishevel person involved pre-employment card kzl
1898,anggaran t dipakai buka blk kayaknya kartu pra kerja,budget used open blk t think a pre-employment card
1899,sasaran kartu pra kerja sih,target pre-employment card anyway
1900,paket kartu pra kerja,pre-employment card package
1901,didalam gedung hati nurani tolong pemerintah uang triliunan kartu pra kerja hasilnya apaka,in the building conscience card please government trillions of pre-employment result apaka
1902,ceo portal berita gresnews agustinus edy mengungkap kejang,ceo Augustine gresnews news portal edy reveal seizures
1903,pelatihan kartu pra kerja,pre-employment training card
1904,kpk usut tuntas kartu pra kerja bgm kawan,kpk usut complete a pre-employment card bgm friend
1905,recehan noh program kartu pra kerja t usuuut,noh coins card pre-employment program t usuuut
1906,pendaftaran kartu pra kerja manual didata yg pelatihan l,registration card manually recorded a pre-employment training that l
1907,kartu pra kerja idenya bagus yg pengelolaan budgetnya yg ga efektif rb pelatihan,card pre-employment nice idea that effective management of the purse yg ga rb training
1908,, 
1909,pasal wn berhak pkrjaan pnghdupan yg layak bejibun pengangg wni yg mesti,wn article entitled pkrjaan decent pnghdupan who bejibun pengangg wni who must
1910,kartu pra kerja,pre-employment card
1911,kesotoyan gw ajh ya pemerintah gk kerjasama akses gratis,kesotoyan gw gk government cooperation ajh yes free access
1912,mas video solusi pendidikan pemerintah bikin digital wallet bikin wadah pl,mas video solutions make government education digital wallet to make containers pl
1913,serius ngebacot in pemerintah kartu pra kerja bancakan kemana unt,ngebacot serious pre-employment in government bancakan card where unt
1914,kejanggalan kartu pra kerja ditanggapi ruangguru agustinus edy,pre-employment card irregularities Augustine addressed ruangguru edy
1915,agustinus edy kejanggalan kartu pra kerja ruangguru angkat bicara berita,Augustine card irregularities pre-employment edy spoke ruangguru news
1916,kesadaran berdoa system lakukan scoring ac,do pray awareness scoring system ac
1917,catat syarat daftar kartu pra kerja online,note cards list a pre-employment requirement online
1918,catat syarat daftar kartu pra kerja online,note cards list a pre-employment requirement online
1919,case kartu pra kerja contoh menarik terkait minimnya kolaborasi stakeholder mengakibatkan,pre-employment card case interesting examples related lack of stakeholder collaboration resulted
1920,wrk ga kebagian kartu pra kerja pengen belajar ilmu nih,ga wrk card gets a pre-employment ya want to learn science
1921,orang memperdebatkan platform mitra prakerja penerima kartu pra kerja mengambil p,prakerja partner platform to debate a pre-employment card recipients taking the p
1922,enak yg jualan kelas diprogram kartu pra kerja bikinnya dibayarnya berkali youtuber aja sekalia,who sells tasty class pre programmed card bikinnya unpaid work youtuber wrote many sekalia
1923,pa presiden usul materi pembelajaran kartu pra kerja yg menjamin hidup,pa president proposed a pre-employment card learning materials that ensure the survival
1924,tutorial kyk ginie yg disediakan dlm kartu pra kerja ruang guru gak,Ginie kyk tutorial that provided pre-employment card dlm not the teachers' room
1925,iyah kartu pra kerja,Iyah pre-employment card
1926,case kartu pra kerja berlanjut kedepannya muncul gimana konsep kolaborasi quadraple helix an,pre-employment card case continues to appear in the future how the concept of collaboration quadruple helix late
1927,bakar duit kartu pra kerja gimana pemerintah bikin channel youtube pelatihan online,Fuel card money how governments make a pre-employment training youtube channel online
1928,kartu pra kerja bisnis digital t mulusss eee tengsin tongkat batu tanaman mas koes,pre-work digital business card t mulusss eee Tengsin cane plant stone mas koes
1929,bakar duit kartu pra kerja gimana pemerintah bikin channel youtube pelatihan online,Fuel card money how governments make a pre-employment training youtube channel online
1930,bakar duit kartu pra kerja gimana pemerintah bikin channel youtube pelatihan online,Fuel card money how governments make a pre-employment training youtube channel online
1931,tuh om kartu pra kerja,tuh om pre-employment card
1932,cetak uang hentikan agenda infrastruktur mendesak pembangunan jalan tol tid,stop printing money urgent infrastructure development agenda motorway tid
1933,temen gw aja udh kerja loh daftar kartu pra kerja niatnya gw daftar sih saldonya top up ga,temen gw aja loh udh job cards list a pre-employment intentions gw top up their balances heck list ga
1934,mikirnya kartu pra kerja dpt pelatihan praktek langsung cak cek das des trus dpt uang k dlm b,mikirnya cards interchangeable pre-employment checks practical training directly smack das des trus dpt money k dlm b
1935,lha tujuan bwt kartu pra kerja,LHA card bwt pre-employment goal
1936,agustinus edy kejanggalan kartu pra kerja ruangguru angkat bicara rahel narda ch,Augustine edy irregularities pre-employment card ruangguru Rachel spoke Narda ch
1937,kartu pra kerja sekelompok org kaya dikasih duit negara t org miskin dikasih duit rb,card pre-work group of rich org org t given money poor countries are given money rb
1938,seleksi kartu pra kerja menurutku msh blm ok sasaran temenku yg memalsukan data pdhl,pre-employment card selection ok I think msh blm temenku goals adulterate the data pdhl
1939,agustinus edy kejanggalan kartu pra kerja ruangguru angkat bicara rahel narda chaterine d,Augustine edy irregularities pre-employment card ruangguru Narda spoke Rachel Catherine d
1940,ceo portal berita gresnews agustinus edy mengungkap kejanggalan kelas online skill acade,ceo Augustine edy gresnews news portal online class skill uncover irregularities acade
1941,min daftar kartu pra kerja online ngk online,min list card pre-employment online NGK online
1942,wni mah sabar aja jokowi wni daftar aja kartu pra kerja biar dap,wni patient mah aja aja jokowi wni list of pre-employment cards let dap
1943,tdk masuk daftar blt regist kartu pra kerja linknya jg error nasib pandemi covid,ill in the list of pre-employment blt card regist link error jg pandemic fate covid
1944,sayang kartu pra kerja rakyat jelata kerja tka cina aja makan tuh karu,pre-employment card dear rabble tka work china aja tuh eat karu
1945,besok demo temanya kartu pra kerja dana besarnya dikasih program yg efektivitas nya teruji,tomorrow demo pre-employment card theme magnitude fund that program given its proven effectiveness
1946,kejanggalan kartu pra kerja ditanggapi ruangguru agustinus edy ce,pre-employment card irregularities Augustine addressed ruangguru edy ce
1947,andi rio idris padjalangi kartu pra kerja solusi kesulitan rakyat ditengah pandemi covid,andi rio Idris card padjalangi pre-employment difficulties of people amid pandemic solutions covid
1948,boro boro ngurusin kartu pra patah hati ngurusin kartu pra kerja aja amburadul,boro boro ngurusin pre gutted card pre-employment card ngurusin wrote in shambles
1949,dpr nilai program kartu pra kerja dirasakan masyarakat,dpr value card pre-employment program felt by the public
1950,salah orang yg kebagian jatah trilliun proyek kartu pra kerja miris,any person who acquired the allocation of pre-employment trillion sad card project
1951,publik terfokus ulah mantan stafsus milenial kartu pra kerja rp t eh yg terlewat bi sdh kucurkan q,public focused act of the former pre-employment stafsus card millennial rp t er who missed bi SDH drizzle q
1952,sqw barusan coba daftar kartu pra kerja maksudnya gimana,SQW just now trying to register a pre-employment cards mean how
1953,mas agustinus posting dah beberin pjg leb,Augustine mas dah post beberin pjg LEB
1954,kebijakan pemerintah usulan kartu pra kerja salah alasan pekerja buruh bernafas,government policy proposals pre-employment card one reason labor workers breathe
1955,kartu pra kerja serfitikat nya jga ya kursus nya hmm,Her pre-employment card serfitikat jga hmm yes its course
1956,agustinus edy kejanggalan kartu pra kerja ruangguru angkat bicara,Augustine card irregularities pre-employment edy spoke ruangguru
1957,oh mitra digital platform pemerintah program kartu pra kerja m,oh digital partner government platform card pre-employment program m
1958,tanyainrl yg daftar kartu pra kerja pilih pelatihan daftar,tanyainrl reply card list select a pre-employment training list
1959,lu gak setara jahatnya ujian kartu pra kerja,lu not the evil equivalent pre-employment test card
1960,agustinus edy kejanggalan kartu pra kerja ruangguru angkat bicara rahel narda chaterine detiknews kamis,Augustine edy irregularities pre-employment card ruangguru Narda Catherine Rachel spoke Thursday Detiknews
1961,trims maaf out of topic kabar perkembangan kartu pra kerja kota medan bgmana bu,trims sorry out of topic news developments pre-employment card city bgmana field bu
1962,program kartu pra kerja jlan,pre-employment program jlan card
1963,kalo mnurut sudut pandang gw kartu pra kerja duitin coursenya ngakalin ajasih perjanjian,if mnurut viewpoint card gw pre-employment agreement duitin coursenya ngakalin ajasih
1964,halo kak utas melampaui batas kewarasan kesaksian peserta program kart,hello kak thread beyond the limits of sanity testimony kart program participants
1965,kartu pra kerja kursus online gitu mending diarahin kursus bnsp training disnaker,pre-employment card online courses so mending diarahin BNSP training courses Disnaker
1966,viral korban phk kartu pra kerja,victims viral dismissed pre-employment card
1967,salam kartu pra kerja beli video rp trilyun pelatihan gratis presiden,greeting cards and purchase a pre-employment training videos free trillion rp president
1968,ngelamar kerja hrd kelebihan kartu pra kerja yak lolos,HRD working ngelamar excess yak passes a pre-employment card
1969,akal an bengkel gw berdoa ya allah laknatlah orang yg memakan uang disaat rak,sense an i pray ya allah workshop laknatlah person who takes money while shelving
1970,kartu pra kerja kebijakan presiden dukung,pre-employment card bearing the president's policies
1971,kartu pra kerja niatnya semi bansos didahulukan rb biaya hidup selaam jt bi,card pre-employment intentions rb semi bansos precedence living costs selaam jt bi
1972,kartu pra kerja kampanye jokowi wabah covid jd program penanggulangan covid dgn triliun pel,pre-employment card jokowi campaign jd covid outbreak prevention program with trillions mop covid
1973,baca berita dugaan proyek kartu pra kerja disusun mitra yg proyek regu,read news alleged pre-employment card project partners who drafted the project team
1974,kartu pra nk kerja ya,nk pre cards work yes
1975,kartu pra kerja jurnalis jual beli kelas online ruangguru,pre-work journalist card purchase online classes ruangguru
1976,udah korupsi kartu pra kerja diam,corruption is already a pre-employment cards silence
1977,agustinus edy kejanggalan kartu pra kerja ruangguru angkat bicara,Augustine card irregularities pre-employment edy spoke ruangguru
1978,, 
1979,agustinus edy kejanggalan kartu pra kerja ruangguru angkat bicara ceo po,Augustine edy irregularities pre-employment card ruangguru ceo spoke po
1980,agustinus edy kejanggalan kartu pra kerja ruangguru angkat bicara ceo po,Augustine edy irregularities pre-employment card ruangguru ceo spoke po
1981,agustinus edy kejanggalan kartu pra kerja ruangguru angkat bicara ceo po,Augustine edy irregularities pre-employment card ruangguru ceo spoke po
1982,agustinus edy kejanggalan kartu pra kerja ruangguru angkat bicara ceo po,Augustine edy irregularities pre-employment card ruangguru ceo spoke po
1983,agustinus edy kejanggalan kartu pra kerja ruangguru angkat bicara ceo po,Augustine edy irregularities pre-employment card ruangguru ceo spoke po
1984,agustinus edy kejanggalan kartu pra kerja ruangguru angkat bicara ceo po,Augustine edy irregularities pre-employment card ruangguru ceo spoke po
1985,kartu pra kerja belom,Keith pre-employment card
1986,dpr nilai program kartu pra kerja dirasakan masyarakat,dpr value card pre-employment program felt by the public
1987,bray belva ga paham ya netizen kemarin prosedur rg,Belva bray ga ya know netizen yesterday procedure rg
1988,kartu pra kerja channel bang sobat dapur,pre-employment card channel bang buddy kitchen
1989,sertifikat kartu pra kerja,pre-employment card certificates
1990,proyek kartu pra kerja,pre-employment card project
1991,agustinus edy kejanggalan kartu pra kerja ruangguru angkat bicara ceo po,Augustine edy irregularities pre-employment card ruangguru ceo spoke po
1992,agustinus edy kejanggalan kartu pra kerja ruangguru angkat bicara ceo po,Augustine edy irregularities pre-employment card ruangguru ceo spoke po
1993,agustinus edy kejanggalan kartu pra kerja ruangguru angkat bicara ceo po,Augustine edy irregularities pre-employment card ruangguru ceo spoke po
1994,agustinus edy kejanggalan kartu pra kerja ruangguru angkat bicara,Augustine card irregularities pre-employment edy spoke ruangguru
1995,mudah mudahan covid menyadarkan presiden bhw manusia bangunan pendidikan kesehatan l,hopefully covid sensitize human bhw president of health education building l
1996,gojek traveloka menolak mitra kartu pra kerja ceritanya yuk dibaca geas,gojek traveloka reject a pre-employment card partners yuk story read geas
1997,dinilai bermanfaat asosiasi ojol dorong driver mendaftar kartu pra kerja yuk yg belom daftar,considered beneficial association thrust ojol register card drivers who have not pre-work yuk list
1998,cair kartu pra kerja,Liquid pre-employment card
1999,reply kartu pra kerja tuitnya barusan dihapus ya bang,pre-employment reply card tuitnya recently deleted ya bang
2000,legislator gerindra mendukung program kartu pra kerja atasi dampak covid,gerindra legislators to support a pre-employment program to overcome the effects cards covid
2001,agustinus edy kejanggalan kartu pra kerja ruangguru angkat bicara,Augustine card irregularities pre-employment edy spoke ruangguru
2002,loh peserta kartu pra kerja yg pilih modul pelatihannya salah ngaco lo,loh card participants who select a pre-employment training modules one awesome lo
2003,kartu pra kerja yg diharapkan buruh yg terdampak covid ya,pre-employment card expected that the affected workers covid yes
2004,instruksi jokowi kartu pra kerja diprioritaskan korban phk,pre-employment instruction card jokowi prioritized victims dismissed
2005,pemerintah tamak sih sisi nyikat kartu pra kerja cuan sisi bangun blk balai latih,government greed really the brush card pre-employment cuan side up blk train station
2006,karyawan ijin ga masuk kerja alasannya bikin kartu pra kerja pdhl msh kerja sm gw asli aneh,ga permit employees to come to work to make a pre employment reasons pdhl msh original work odd gw sm
2007,nganggur nganggur kerja pilih pantes aja susahnya pengangguran kartu pra kerja,Idle Idle wrote hard work pantes unemployment select a pre-employment card
2008,pemerintah ngotot realisasikan kartu pra kerja dg angg t alokasikan t u pelatihan pandemi co,government insist on pre-employment card realisasikan Angg dg t u t allocate pandemic training co
2009,ceo portal berita gresnews agustinus edy mengungkap kejanggalan kelas online skill academ,ceo Augustine edy gresnews news portal online class skill uncover irregularities academ
2010,agustinus edy kejanggalan kartu pra kerja ruangguru angkat bicara ceo po,Augustine edy irregularities pre-employment card ruangguru ceo spoke po
2011,mengurangi beban masyarakat pemerintah jenis jaring pengaman sosial kartu sembako subsidi listrik ka,reduce the burden of government public social safety net type of card groceries electricity subsidy ka
2012,kartu pra kerja polemik masyarakat masyarakat melek inet kelas menengah terbantu sementa,pre-employment card literacy community public polemic inet middle class helped sementa
2013,firli gmn dgn penunjukan langsung proyek kartu akal akalan pra kerja yg m,firli gmn with direct appointment card project that pre-employment deceivingly m
2014,rame rame program kartu pra kerja kartu iki nggo opo asline kartu ajaib ngono po piye,noisy crowded card program is a pre-employment card for the original card or a magic case of po
2015,ambil kartu pra kerja yuuk,take a pre-employment card yuuk
2016,undangan kartu pra kerja email kalo ngga ambil gapapa mung,pre-employment card invitation email if guns take mung gapapa
2017,undang undangnya kartu pra kerja jalan apbn,its laws pre-work legislation cards revised state road
2018,pendampingan kartu pra kerja jg konsultan umkm center berlokasi salatiga org pendaftar kartu,jg pre-employment assistance consultant card SMEs org registries center located salatiga card
2019,ya yg kartu pra kerja ha ha gimana sih ha ha nggak pah ju,so that a pre-employment card ha ha ha ha how does not pah ju
2020,gelontoran uang kartu pra kerja kejanggalan ketidak transparansian pemerintah be,pre-employment gelontoran card money gaffe lack of government transparansian be
2021,pendampingan terhdp org pendaftar kartu pra kerja yuuk yg yg dida,terhdp assistance card applicants pre-employment org yg yg yuuk dida
2022,ya kontra kartu pra kerja fungsinya bkn polemik sistem rekrutnya kerjasama,yes counter card pre-work function bkn polemic rekrutnya system of cooperation
2023,kalo budget triliun mah gue bikin video narasumber sekaliber garyvee kali ya barrack obama gary,mah trillion budget if I make video sources caliber garyvee times yes barrack obama gary
2024,ya gua berharap yg skrg ngata in kartu prakerja besok gausah apply munafik y,yes cave hoping that skrg Ngata in prakerja card tomorrow gausah apply hypocritical y
2025,dipikir pikir bener ya kartu pra kerja is totally shit t kalo dialokasiin penanganan pandemi dapet aja ya,Come think Bener yes card pre-work is totally shit t if dialokasiin handling of the pandemic dapet aja
2026,gimana nih kartu pra kerja nya jokowi,how ya its pre-employment card jokowi
2027,april pendampingan pendaftaran kartu pra kerja kantor dinas koperasi usaha mikro peri,april card registration pre-employment assistance offices fairy cooperative micro enterprises
2028,kpk kartu pra kerja ngga makan,kpk card pre-work meal guns
2029,asli kirain kartu pra kerja dipake pelatihan kaya blk ngono hahahancokkk,kirain original card using that pre-employment training blk ngono rich hahahancokkk
2030,memasukan program jaring pengaman sosial utk pekerja informal masuk kategori miskin rentan miskin pemer,enter the program of the social safety net for workers in the category of poor informal government The vulnerable poor
2031,refinance mobil sulit banget bank jaga jarak kartu pra kerja kuotanya orang yg emang butuh terba,very difficult car refinance bank cards keep the pre-employment quota of people who weve need terba
2032,temen kerja daftar kartu pra kerja,friend card list a pre-employment work
2033,perihal kartu pra kerja tau standar orang dapet yg ku tau yg bebe,concerning pre-employment card dapet people who know my standard reply tau bebe
2034,tumbuhkan kebersamaan kandangin buzzer influenser yg terang benderang kehangatan berwarga negara hil,grow together kandangin buzzer bright warmth influenser who are citizens hil
2035,opo gur sik kudet kartu pra kerja ki opo,opo sik kudet gur ki opo pre-employment card
2036,melukis tradisi kelompok menengah penerima kartu pra kerja kelompok,painting tradition medium group pre-employment card recipient group
2037,menggarong uang rakyat kartu pra kerja simak penjelasan vidio nggak diawasi,plunder of public money pre-employment card see explanation vidio not supervised
2038,seru banget bahasan kartu pra kerja brow,really exciting pre-work discussion brow card
2039,baca yg kartu pra kerja t rakyat patungan serasa negara gak pu,read the card that pre-work state seemed joint t people do not pu
2040,poin utama kartu pra kerja sasaran,The main points of the target pre-employment card
2041,ya gua berharap yg skrg ngata in kartu prakerja besok gausah apply munafik,yes cave hoping that skrg Ngata in prakerja card tomorrow gausah apply hypocritical
2042,baca ginian nyumpah nyumpahin org yg terlibat kartu pra kerja kzl,read ginian curse dishevel person involved pre-employment card kzl
2043,memasukan program jaring pengaman sosial utk pekerja informal masuk kategori miskin rentan miskin ole,enter the program of the social safety net for workers in the category of poor informal vulnerable poor ole
2044,kartu pra kerja ga kerja orang dalem klo usa,pre-employment cards work the palace klo ga usa
2045,temen kerja daftar kartu pra kerja,friend card list a pre-employment work
2046,program meringankan juta pekerja sektor formal jaring pengaman sosial pekerja sektor inform,program lighten million formal sector workers social safety nets inform workers
2047,kartu pra kerja,pre-employment card
2048,yg hrs dinaikan membuktikan kartu pra kerja akal an korupsi yg merugikan negara coursera b,yg hrs card proves pre-employment increased sense an pestilent corruption Coursera country b
2049,bikin malu pembelajar onlen aja nih program abal kartu pra kerja dikiranya pelatihan onlen ky gitu e,onlen learners disgrace aja nih a pre-employment program card abal onlen ky thought was training so e
2050,maksudnya ngambil untung kak tp ngebuktiin system kartu pra kerja ga be,ngambil mean profit kak ngebuktiin system tp ga be a pre-employment card
2051,tp namanya kartu pra kerja kepenting,tp pre-work card name kepenting
2052,kartu pra kerja target juta orang diterima gelombang ribu gelombang ribu peserta mendap,card pre employment targets million people received waves of waves of thousands of participants silt
2053,trims mas sharing pencerahannya implementasi kartu pra,trims mas sharing pre enlightenment card implementation
2054,nomor kartu pra kerjanya hilang dashboard,lost its pre card number dashboard
2055,yg orang yg pkh bnpt bansos kartu pra kerja mas blt diambi,CCT that people who pre-employment BNPT mas card bansos blt diambi
2056,cetak uang hentikan agenda infrastruktur mendesak pembangunan jalan to,stop printing money urgent construction of road infrastructure agenda to
2057,menkeu didesak alihkan anggaran pelatihan kartu pra kerja blt,Finance Minister urged switch card pre-employment training budget blt
2058,keistimewaan korban phk program kartu pra kerja,dismissed the victim privilege card pre-employment program
2059,peserta nikmati kartu pra kerja daerah,Participants enjoy a pre-employment card area
2060,juta orang daftar kartu pra kerja presiden jokowi prioritas korban phk,million people a list of pre-employment card jokowi president dismissed the victim priority
2061,dah kartu pra kerja bong,dah pre-employment card bong
2062,kartu pra kerja kemaren gunanya,pre-employment card yesterday pointless
2063,mengaplikasikan metode daring program kartu pra kerja yg bek,online method to apply a pre-employment program that defender card
2064,mas sempet liat postingan mengkhawatirkan kartu pra kerja,mas posts sempet clay alarming pre-employment card
2065,ya sesulit apapun jalan daftar kartu pra kerja hubungi teman,yes as difficult as any pre-employment path card listing contact a friend
