,0,translate
632,halo rekanaker daftar program yuk kartu prakerjamu pelatihan sisnaker,hello rekanaker list prakerjamu card yuk training program sisnaker
633,what does it mean,what does it mean
634,kalo kayak gini ketrima ngga si,I like this and not acceptable
635,sosialisasi online kartu pra kerja,card online pre-work socializing
636,ongkos kartu pra kerja ditransfer orang peserta gelombang mencairkan uan,pre-employment card charges transferred participants dilute wave uan
637,platform digital mitra kartu prakerja mengambil komisi alasannya,digital platform partners take commissions reason prakerja card
638,wajar marketplace menyediakan akses peserta kartu pra kerja memilih lembaga pelatihan,fair marketplace provides access card participants choose a pre-employment training institutes
639,, 
640,wajar marketplace menyediakan akses peserta kartu pra kerja memilih lembaga pelatihan,fair marketplace provides access card participants choose a pre-employment training institutes
641,skrang gk login,skrang gk login
642,peserta masuk program kartu pra kerja dipilih acak sistem sasaran,Participants sign a pre-employment program randomly selected cards target system
643,peserta masuk program kartu pra kerja dipilih acak sistem sasaran,Participants sign a pre-employment program randomly selected cards target system
644,pemerintah membuka peluang aplikator penyedia pelatihan online mitra kartu pra kerja,Government opportunities online training provider partners applicator pre-employment card
645,pemerintah memilih peserta masuk program kartu pra kerja,government chooses participants a pre-employment program admission card
646,pemerintah memilih peserta masuk program kartu pra kerja via,government chooses participants a pre-employment program admission cards via
647,mintra program kartu prakerja pemerintah buka lo syarat,mintra government prakerja card program is open lo requirement
648,kawanakerpmptsp kota malang terdaftar kartu prakerja mohon bijak memilih pelatihan kartu,kawanakerpmptsp registered poor town prakerja card please choose wisely card training
649,halo kak udah lolos bingung pake kartu prakerja nya hubungi no ya kak n,hello kak already escaped confused prakerja card use his contact no yes kak n
650,hilang asa,lost hope
651,pemerintah membuka peluang aplikator penyedia pelatihan online mitra kartu pra kerja ca,Government opportunities online training provider partners applicator pre-employment card ca
652,rp kartu pra kerja,rp pre-employment card
653,utas pastikan pelatihan pilih menyediakan sertifikat sesuai minat bakat miliki,thread ensure appropriate training of select presents certificates have the talent interests
654,pemerintah membuka peluang aplikator penyedia pelatihan online mitra kartu pra kerja ca,Government opportunities online training provider partners applicator pre-employment card ca
655,pemerintah pastikan mitra platform digital kartu prakerja bertambah,governments make digital platform partners to grow prakerja card
656,ongkos kartu pra kerja ditransfer orang peserta gelombang menc,pre-employment card charges transferred participants menc wave
657,berulang kali kucoba masuk kedalamnya ku,I tried to get into it repeatedly ku
658,ongkos kartu pra kerja ditransfer orang peserta gelombang menc,pre-employment card charges transferred participants menc wave
659,bingung proses feel free dm yaa dibantu sepenuh hati udah lolos share dib,confused process yaa feel free dm assisted wholeheartedly share already escaped dib
660,temen temen pengumuman gelombang yaaa keterima hati gelom,temen temen yaaa wave announcement liver keterima gelom
661,disana sharing membantu prakerja,there sharing helps prakerja
662,pekerja kena phk terdampak covid butuh uang tunai pelatihan online kumaa,workers affected by the termination of contact with covid need cash online training kumaa
663,bener beli sembako pekerja kena phk terdampak covid butuh uang tunai pelatihan online,Ko buy groceries workers affected by the termination of contact with covid need cash online training
664,login prakerja,login prakerja
665,warga ber ktp kota pekalongan lolos kartu prakerja silahkan isi form link ya,Air ktp Pekalongan city residents escape prakerja card please use the form link yes
666,lowongan pekerjaan,job vacancy
667,saldo kartu prakerja,prakerja card balance
668,pesan pandemic kelar manusia hewan,human pandemic message finished animals
669,guys gelombang ketiga uda dibuka buruan gabung goodluck,The third wave of younger guys opened quarry join goodluck
670,lolos prakerja gelombang dm yah biar dibantuin tahap,dm wave prakerja qualify well let dibantuin stage
671,utas pastikan pelatihan pilih menyediakan sertifikat sesuai minat bakat mil,thread ensure appropriate training of select presents certificate of interest talents mi
672,kawanakerpmptsp kota malang terdaftar kartu prakerja mohon bijak memilih pelatihan kar,kawanakerpmptsp registered poor town prakerja card please wisely choose training kar
673,langkah biar lolos kartu pra kerja jokowi,step pre-work let card passes jokowi
674,alhamdullilah lulus kartu prakerja,alhamdullilah pass prakerja card
675,papua barat ribu kartu pra kerja,West Papua thousand cards pre-employment
676,point d e wallet up grade la foto ktp rapi now plontos ga up grade ga,point d e wallet up grade la foto ktp rapi now plontos ga up grade ga
677,fokus utama program kartu prakerja kawanakerpmptsp kota malang salam,The main focus prakerja card program kawanakerpmptsp poor town greetings
678,selamat untk temen yg alhamdulillah udh lolos saldonya kuy kalo yg ditanyaka,Alhamdulillah remedy friend who survived escaped UDH Kuy balances if that ditanyaka
679,terkait program kartu prakerja pks situasi pandemi dibutuhkan penerima manfaat pelatihan,pks prakerja card program related pandemic situation required the training of beneficiaries
680,yo yo yo suaranya yg lulus gelombang info bergandeng tangan lewati step,yo yo yo sound waves that pass the info joined hands skip step
681,inin girls akuu temen esema gelombang huhuuuu terharu maapin lebay bayangin aja dr,inin girls akuu friends esema huhuuuu wave moved maapin lebay imagine aja dr
682,senin jam hadewwww yg sabarrrr ajaaaaa,Monday hours hadewwww who sabarrrr ajaaaaa
683,tau gak disambungkan rekening gimana sih paham aq mohon pencerahannya d,gak tau connected accounts aq understand how does beg enlightenment d
684,halo kakak kakak bingung ambil pelatihan prakerja diskusi,hello brother sister take training prakerja confused discussion
685,haiii temen temen yg dinyatakan lolos kartu prakerja tampilan dashboard yahh ohiyaa yg bing,haiii friend friend who passed prakerja card yahh ohiyaa dashboard display that bing
686,yah dah harian gini mulu heran,Well I just wonder like this daily
687,ugrade skill,incorporate skill
688,stop go aplikasi supir transportasi online profesional by dedi triputra,stop go online professional transport driver application by dedi Triputra
689,tnggapan jujur kecewa hasil seleksi pengumumannya tolong bap,tnggapan honestly disappointed the selection result announcement please bap
690,pagi mutualan kuy,Mutual morning kuy
691,yalord nangis terharu sekian banyaknya yg bantuin gelombang akhirnyaaa sepupu a,yalord cry touched the many who bantuin wave a cousin akhirnyaaa
692,halo temen temen gelombang udah loh udah lulus bingung gimana,hello friend's apartment wave already loh already graduated confused how
693,psbb prakerja berhasil,psbb prakerja succeed
694,, 
695,, 
696,, 
697,, 
698,, 
699,, 
700,, 
701,, 
702,, 
703,hai ayo jg bantu salam,O let jg greeting aids
704,i love monday,i love monday
705,parodi pelatihan online,parody online training
706,cari cp mika,find cp mica
707,kartu prakerja gelombang yg udah lolos,prakerja card wave that is already escaped
708,kak time limit penggunaan saldo pembelian pelatihan tanggl,kak time limit the use of the balance of the purchase of training tanggl
709,meneng o nek ra ngei meneng o,o ra screw that provide screw o
710,ntah bingung kalo sperti gimana tanggal gak rubah nov,ntah just as how dates confused if not fox nov
711,prank suasana cocit mengendutkan kepentingan segelintir pribadi negeri ngeri,prank atmosphere mengendutkan cocit private interests of a few horrific state
712,langit biru korona jakaa pagi hempas hujan badai keserakahan jakaa,Jake corona blue sky morning thunderstorm buffeted greed Jake
713,, 
714,kaya gitu ya daftar gelombang blom konfirmasi lolos nggaknya status sed,yes so rich list Blom wave passes nggaknya confirmation sed status
715,, 
716,ga x daftar x gagal kuota dah habis temen hp daftar kali ktp foto,ga x x fail quota list dah exhausted friends hp list of times ktp photo
717,cari cp mika,find cp mica
718,cari cp mika,find cp mica
719,, 
720,daftar erorr login eroro liat hasil eroro gimana si kaya nya emang gak niat gimana masyarakatnya,erorr list login eroro clay eroro how the rich results of his intent emang not how society
721,btw apasih kartu prakerja kartu prakerja program pengembangan kompetensi bantuan biaya dituju,btw apasih prakerja card prakerja card competency development program targeted financial assistance
722,opinion dominique virgil of and executive director of the discusses how effective jokowi s pr,opinion dominique virgil of and executive director of the discusses how effective jokowi s pr
723,menunggu pekerjaan,waiting for job
724,opinion dominique virgil of and executive director of the discusses how effective jokow,opinion dominique virgil of and executive director of the discusses how effective jokow
725,mendaftar bimbang sukar terkesan ngambang berhasil gagal bukti fisik sebaga,register undecided difficult floating impressed successfully failed physical evidence sebaga
726,presiden menuai kritik solusi nggak via,president criticized not the solution via
727,mendaftarkan kesukaan bisnisnya berjalan normal selanj,A registered business running normally selanj
728,mendaftarkan bisnis lokal selamat mudah kasih link nya,Local businesses easily register link love his congratulations
729,bisnis aja bantu kesimpulan grup bisnis b,wrote businesses conclusions auxiliary business group b
730,ribuan orang mendaftar program kartu prakerja memangnya menarik diperoleh peserta kartu,thousands of people sign up for the card program participants prakerja memangnya obtained card draw
731,hai tampilan yg lolos prakerja gelombang yaa adakah yg lolos dita bantu arahkan yuk dapet,hi see who escaped prakerja yaa wave Dita is there that escaped direct aids yuk dapet
732,sesulit kartu prakerja daftar pas buka gelombang full,prakerja card as difficult as fitting list open full wave
733,kartu prakerja daftar kursus online gratis,prakerja card free online course list
734,konyol khursus kartu prakerja,silly card khursus prakerja
735,halo warga twitter yg lulus gelombang info yaa biar pandu sel,hello twitter residents who passed the info yaa let waveguide wave cell
736,kuota gratis indosat ooredoo kalo kasi tau gb lumayan nemenin ka,free quota Indosat Ooredoo gb passable if kasi tau ka nemenin
737,what gelombang kau prakerja ga lolos emmmhhhh coba pengen tau aja yg lolos kepo ak,prakerja wave ga what you want to know the escape emmmhhhh try to qualify for police aja ak
738,bingung ttg mekanisme prakerja skill academy cek email faq t,ttg confused prakerja mechanism skill academy t check email faq
739,polemik ruangguru perusahaan asing singapura,ruangguru polemic foreign companies singapore
740,nih udh lulus tp bingung pilih pelatihan,tp udh nih pass puzzled select training
741,program aspek peluncuran program besaran biaya mitra pemberi pe,aspects of the program launch fee scale program provider partners pe
742,problem solving kali merelakan,problem solving time volunteer
743,prgram pemerintah yg hnya tuk kepentingan bisnis tdk tuk membntu rakyat kcil seleskinya tdk jls dimn l,prgram government business interests who hnya tuk tuk membntu morbidly ill people kcil seleskinya JLS dimn l
744,kartu pra kerja offline link,card pre-work offline link
745,terrealisasikan tpi ketidakadilan kartu prakerja k,TPI terrealisasikan prakerja card injustice k
746,teman yg program kartu prakerja gelombang pengumuman ya ayo yg lulus info y,friends who prakerja card program yes let's announcement waves which pass the info y
747,pingin kartu prakerja skiil academy ruangguru hubungi nomer te,skiil prakerja card pingin academy ruangguru contact number te
748,agustinus pemred prakerja program niat membantu masyarakat ti,Augustine Chief Editor prakerja intention of helping the community program ti
749,apaapan pembukaan eror gelombang iktan jam setlah dibuka,apaapan error opening hours setlah opened iktan wave
750,salah diriku padamuu,one myself padamuu
751,tolong yg peduli bantuannya,please reply to care aid
752,pendidikan ruangguru kaya raya trilyun mundur mu uang belvara,ruangguru rich educational retreat trillion mu money belvara
753,mundur stafsus krn hmpir proyek kartu gelombang dikuasai dpr su,krn stafsus retreat hmpir controlled wave card project dpr su
754,alih meningkatkan skills org indo yg ditawarkan hny sebatas pelatihan ojol bahasa inggris kenalkan pembuat,than improving skills indo yg org hny limited offer English language training ojol introduce maker
755,part kartu bilang aja gak terima bayar opsi,said card part wrote not receive pay option
756,yg dibenahi,who addressed
757,pendidikan ruangguru kaya raya trilyun mundur mu uang belvara sement,ruangguru rich educational retreat trillion mu money belvara cement
758,yg masi pilih pelatihannya sputar pelatihan prakerja x skill academy ya k,yg masi select sputar coaching skills training academy yes prakerja x k
759,pendaftaran prakerja gel tutup april kemarin yg udah dftr gel jgn lupa cek berkala,april prakerja registration closed yesterday gel that is already banned list gels do not forget to check periodically
760,salah kaprah kartu prakerja maman abdurahman jamin praktek korupsi,misguided Maman Abdurrahman prakerja card guarantee corruption
761,jual rugi ebook,loss selling ebook
762,jualrugi,jualrugi
763,gak paham proyek dikuasai itubisa dikaitkan,do not understand the project associated controlled itubisa
764,jualrugi,jualrugi
765,baca berita tgl mei cair skrg ga proses orang tulisan,read news liquid mei skrg ga date the writing process
766,rame obrolan media sosial saldo rekening bri nambah rp diberitahukan sms banking k,crowded social media chatter bri account balances add rp notified sms banking k
767,ebook rahasia jual rugi tokobuku rb akun paypal koneksi bank local bri,loss selling secrets ebook bookstore rb paypal account local bank connections bri
768,salah kaprah kartu prakerja maman abdurahman jamin praktek korupsi,misguided Maman Abdurrahman prakerja card guarantee corruption
769,pelatihan dn sdh mndptkn sertifikat dpt email dr kemenaker jg tp pas cek dashboard prakerja trnyata s,dn training SDH mndptkn email verifiable certificate kemenaker dr jg tp pas check trnyata s dashboard prakerja
770,hai teman teman udah nyobain belajar eztudia pakai prakerja ditanyain ngga niiih,hi friends already nyobain learn eztudia use guns ditanyain prakerja niiih
771,tunjukkan kemahiranmu progres kursus tp sertifikat ga ga lan,kemahiranmu show progress certificate courses ga ga tp lan
772,semoga informasi kode voucher melanj,hopefully voucher code information melanj
773,dilema,dilemma
774,hallo adakah yg lolos daftar prakerja dinyatakan lolos tp bingung bis,hallo there any who qualify for listing prakerja passed tp confused bis
775,lolos prakerja yuuuuk gabung grup biar ga salah langkah dapetin bonus insentif sesuai,yuuuuk prakerja qualify to join the group let ga missteps incentive bonus corresponding dapetin
776,orderan ojol sepi solusinya dgn juta rupiah belajar atur keuangan gak uangnya pela,orderan ojol deserted learning solution with million financial set not his money pela
777,kartu dikaji ulang,card be re-examined
778,kisruh kartu prakerja kpk ppatk dinilai aktif mengawasi anggota komisi iii dr,kpk prakerja card chaotic INTRAC rated active member commission oversees iii dr
779,kisruh kartu prakerja kpk ppatk dinilai aktif mengawasi anggota komisi iii,kpk prakerja card chaotic INTRAC rated active member commission oversees iii
780,k pelathian tata korupsi g,k pelathian system corruption g
781,tamparan counterpart yg menarik merespons akibat covid platform kursus gratis utk sem,looker slap counterpart responded covid platform due to free courses For sem
782,plis prakerja gimana pelatihannya ga diklik pelatihan my,plis prakerja how my training clicked training ga
783,sahur bangun woy t kalo dikelola pemerintah platform sejenis ski la cad my ma b,t dawn wake Woy similar platforms if government-run ski la cad my ma b
784,plis prakerja gimana pelatihannya ga diklik pelatihan,plis prakerja training how ga clicked training
785,semoga yg,I hope that
786,klo gambar data disimpulkan crop gambarnya pas na,Klo concluded the data image crop picture na pas
787,klo gambar data disimpulkan cropnya nggak pas nama a,Klo inferred data images cropnya not fit the name of a
788,data kesimpulannya adlh a yg mw jd ojek online b mumpung diskon dr harga,Data conclusion that mw jd adlh a motorcycle online dr b mumpung discount prices
789,omnibus law phk massal janji manis kartu prakerja warnai may day selengkapnya,omnibus law of mass termination lip coloring prakerja card may day more
790,santai sabtu tanggal mei ya lambat jumat tanggal sekelas pemerintahan ya menghara,Saturday casual Friday date slow mei yes yes menghara dated government class
791,dikasih kartu saldo nya memenuhi kebutuhan beli kon,given its balance card purchasing needs kon
792,menunggu butuh makan,wait needed to eat
793,daftar kartu prakerja gimana yak ga muncul gelombangnya,prakerja card lists how yak ga appear waves
794,mata buta terbuka jiwa penderitaan sesamanya membantu pu,open blind eyes suffering soul neighbor helped pu
795,pelatihan menambah kemampuan skill dapet sert,dapet skills training increase the ability of SERT
796,kartu pra kerja dapet juta orang rinciannya kayak gambar dibawah,pre-employment dapet card details of millions of people like the image below
797,nih kartu andalan pemerintah,card nih mainstay of government
798,ngikutin pelatihan kartu prakerja kuota gb cuman bertahan ditambah insentif tau turunnya,ngikutin training prakerja card last cuman gb quota plus incentives tau downs
799,kesempatan mengasah daya fikir,opportunity to sharpen thinking
800,pembukaan gelombang jam wib gagal program kebanyakan bas,wave opening hours of most bass program failed pm
801,btw yg udah lolos kartu kah kalo udah coba share pengalamannya berharap,btw that is already escaped kah card if already try to share the experience of hope
802,menunggu hasil kelulusan gelombang kartu prakerja,awaiting the results of passing waves prakerja card
803,trus bingung sampe skrg muter otak tetep stabil daftar kartu gel gak lolos,then confused until skrg muter tetep brain stable gel card list do not qualify
804,, 
805,korban gresik diikutkan kartu,gresik victim card included
806,dukung kartu pra kerja nasdem pelatihan daring dievakuasi,support pre-employment card online training NasDem evacuated
807,kisruh kartu prakerja kpk ppatk dinilai aktif mengawasi anggota komisi iii dar,kpk prakerja card chaotic INTRAC rated active member commission oversees iii dar
808,gimana ya konten pelatihannya gak mematuhi persyaratan youtube gimana pelatihan,how ya do not comply with the requirements of the training content youtube how training
809,halo kak mengikuti program gelombang iii bingung yuk gabung gr,hello kak program join our confused wave iii gr
810,pelatihan dijamin ikan ikan manut,training secured fish manut
811,insentif gelombang cair jum at mei nyata nya detik perkembangan,Liquid wave incentives jum at its second real mei development
812,a cashback k dr cair jugaa,a liquid cashback k dr jugaa
813,sy yg kena phk ga daftar error,sy apt dismissed not list error
814,mata buta terbuka jiwa penderitaan sesamanya membantu,open blind eyes suffering soul neighbor help
815,karyawan phk difasilitasi kartu prakerja disnaker link,employee severance prakerja card facilitated Disnaker link
816,wei gw mo nanya ni udah lolos gel prakerja uda masuk ga sih sertifikatnya,Nanya wei ni mo gw already escaped gel prakerja uda ga sih sign certificates
817,nungguin pengumuman prakerja,waiting for the announcement prakerja
818,udah seminggu serti akun praker nya blm muncul insentif cair akun nya udh,already a week certi his praker account p appears his account liquid incentives UDH
819,kak saldo jt langsung habiskan,jt balance immediate kak spend
820,jum at semangat mencari pelatihan prakerja memilih pelatihan prakerja studilmu,jum at the spirit of seeking training prakerja choose prakerja training studilmu
821,deni jumat telat ya intensif santai aja nya senin,deni late Friday wrote his relaxed intensive yes Monday
822,bayarin program sampah bernama,bayarin trash program named
823,kecewa banget sih bug nya yg udah ambil kelas pelatihan udah dapet sertifikat completed contents dapet sertifika,disappointed his bug really does take a training class that is already already get the certificate completed dapet contents sertifika
824,ya tuhan php banget prakerja yg kunjung lolos hidup penuh gelombang prakerja bergelombang,php god yes really prakerja escape alive who go full wave surging prakerja
825,level non acuh digarong kartu serah tdk merata serah,the level of non indifferent robber red card handed out evenly
826,proses kartu prakerja mohon diperbaiki tolong dihentikan mu,prakerja card please improved process please stopped mu
827,selamat udah lolos pendaftaran kartu prakerja bingung memilih platform pelati,congratulations card registration prakerja already escaped confused to choose the platform pelati
828,, 
829,a cashback k dr cair jugaa,a liquid cashback k dr jugaa
830,triliun apbn negara membeli video,State Budget trillion state purchase videos
831,kelas pra kerja ruang guru trainernya ajari bisnis gak berbobot ya,pre-employment classroom teacher trainer teach business space not weight yes
832,class prakerja memakai uang negara berasa gak sesuai ekspekt,prakerja class wearing feel misplaced state money ekspekt
833,hallo kak prakerja skill academy dm chat,hallo kak prakerja skills academy dm chat
834,duit rp triliun kartu prakerja jual beli video tutorial,rp trillion money prakerja card purchase video tutorials
835,kendala menghubungi via email info telp semoga membantu,constraints contacted via email the info tel hopefully help
836,membantu pencari kehilangan pekerjaannya dampak pandemi,help searchers lost his job impact of a pandemic
837,duit rp triliun kartu prakerja jual beli video tutorial,rp trillion money prakerja card purchase video tutorials
838,duit rp triliun kartu prakerja jual beli video tutorial,rp trillion money prakerja card purchase video tutorials
839,duit rp triliun kartu prakerja jual beli video tutorial,rp trillion money prakerja card purchase video tutorials
840,wajib,Required
841,admin verifikasi sertifikat ambil pelatihan yg bgt ya,admin training certificate verification download bgt ya mouth
842,teman yg pengen tau seputar prakerja join grup yaa,friends who want to know about the yaa prakerja join group
843,halo slow respon nih wa email blm respon lulus sertifikat ga,hello ya slow response email wa ga p response graduate certificate
844,tinggal ditunggu aja guys,guys staying awaited aja
845,lolos gelombang prakerja,wave passes prakerja
846,terkena phk dirumahkan dimasukkan program kartu prakerja b,termination exposed housed inserted card program prakerja b
847,tamparan counterpart yg menarik merespons akibat covid platform kursus gratis,looker slap counterpart responded covid platform due to free courses
848,gimana ya konten pelatihannya gak mematuhi persyaratan youtube gimana pelatiha,how ya do not comply with the requirements of the training content youtube how pelatiha
849,udah kartu yuk dimanfaatkan nambah skill banget kelas kursus menarik,yuk card already used nambah skill class really interesting courses
850,main main kesini just sharing kasih masukan seputar yuk join,play play here just sharing the love feedback on yuk join
851,sharing sharing seputar whatsapp me,sharing sharing around whatsapp me
852,semalam dashboard diakses anybody else or is it just me,semalam dashboard diakses anybody else or is it just me
853,selamat buruh,safe trade
854,warning peserta yg sdh lolos program kartu prakerja blh dm komen postingan ya utk dimasukan grup su,sdh warning qualify participants prakerja card program document can post comments dm ya su For group included
855,krtu pra krja program yg msih bingung goals nya penerimanya lapangan pekerjaan ttp terse,krtu pre krja msih programs that confused her goals terse TTP recipients jobs
856,kabar kawan terkena phk pandemi mengalami yu,news friends affected by the pandemic dismissed experienced shark
857,vokal diq pas tbtb wkwk,diq vocals fit tbtb wkwk
858,pengamat hukum pelanggaran hukum program kartu prakerja,legal observers law violation prakerja card program
859,coba deh,try deh
860,pilih pelatihan pra kerja,select a pre-employment training
861,daftar pra kerja noh ikuti caranyaa,pre-employment list noh follow caranyaa
862,info terkini proses evaluasi ya bosan update cek dasboardnyaa bin,latest info evaluation process so bored update checks dasboardnyaa bin
863,, 
864,kakak cari bingung daftar prakerja ya,sister looking confused prakerja list yes
865,pencari blt via program yg terjebak salah mitra pelatihan gegara kesulitan menyeles,blt seekers who stuck one program via training partners gegara trouble menyeles
866,kuy join grupwa yah,Kuy Join Grupwa Yah
867,kuy langsung join grup wa yah insyaallah dibimbing pendaftaran mend,Kuy directly join guided group InsyaAllah yah wa mend registration
868,kuy langsung join grup wa yah insyaallah dibimbing pendaftaran menda,Kuy directly join guided group InsyaAllah yah wa Menda registration
869,prakerja vs youtube,prakerja vs youtube
