,0,translate
0,proyek gak beres,the project not settled
1,alhmdulillah lulus trima kasih semoga bermanfaat,alhmdulillah pass thinks may be useful
2,rutin pelatihan memancing scr online kucing kucing menyenangkan bergu,scr online training routine fishing fun cat bergu
3,makan siang gratis potensi pendapatan anggaran negara yg dibelanjakan peserta program,free lunches state budget revenue potential program participants who spent
4,hak penerima meragukan kredibilitas lembaga materi pelatihan pilih pelatihan aja,the right to doubt the credibility of recipients select training materials training institutions aja
5,jgn dibohongin anak orang palembang bingung pelatihan pempek rb mending,jgn dibohongin palembang confused kid pempek training rb mending
6,kuy isi senggang dg gabung grup chat salah langkah nih kalo llos gelombang kartu prakerj,Kuy spare contents dg join a chat group missteps llos nih kalo prakerj card wave
7,pengen aja nih si n komplotan menjarah,pengen aja nih si n gang loot
8,menilai kartu pra kerja efektif membantu pekerja korban phk dibutuhka,assessing the effective pre-employment cards help workers dismissed victims dibutuhka
9,udah llos kartu prakerja msh nunggu pengumuman gelombang kartu prakerja hayuk kepo sharing gabun,I Llosa card preemployment still waiting for the announcement of a wave card preemployment Come calm merged sharing
10,udah lolos kartu prakerja msh nunggu pengumuman gelombang kartu prakerja hayuk kepo sharing gabu,I pass the card preemployment still waiting for the announcement of a wave card preemployment Come calm broadest sharing
11,yg masi pilih pelatihannya sputar pelatihan prakerja x skill academy ya k,yg masi select sputar coaching skills training academy yes prakerja x k
12,pendaftaran prakerja gel tutup april kemarin yg udah dftr gel jgn lupa cek berkala,april prakerja registration closed yesterday gel that is already banned list gels do not forget to check periodically
13,penelitian terbaru dgn metode big data menyimpulkan sumber utama sentimen negatif pemerintah khusus,The latest research concludes with methods of big data the main source of negative sentiment special government
"14,jakaa menteri keuangan sri mulyani indrawati menanggapi kritik publik menilai da,""jakaa finance minister Sri Mulyani Indrawati, responding to public criticism assess da"""
15,baca berita tgl mei cair skrg ga proses orang tulisan,read news liquid mei skrg ga date the writing process
16,upaya pemerintah meningkatkan kesejahteraan buruh pekerja peluncuran program kartu prakerja,Government efforts to improve the welfare of the worker's worker card program launch prakerja
17,hallo adakah yg lolos daftar prakerja dinyatakan lolos tp bingung bis,hallo there any who qualify for listing prakerja passed tp confused bis
18,gelombang aja skrg kelar gmana dgn gelombang hmm pemerintah jg php,skrg just finished gmana wave with a wave of government hmm jg php
19,agustinus edy kristianto journalist mencari kebenaran skrg menemukan kebenaran proyek ga,Augustine edy kristianto skrg journalist seeking truth find truth ga project
20,indonesia puluhan negara gandeng coursera pelatihan online gratis korban phk,Indonesia dozens of countries articulated a free online training Coursera victims dismissed
21,pemerintah memaksakan skema kartu prakerja dijalankan pandemi program dipersiapkan si,prakerja card scheme imposes a pandemic run the program prepared
22,karyawan kena phk rakyat butuh kerja disuguhkan n,employee severance of contact with the people need work presented n
"23,daftar eits bentar pengumuman kelulusanya yuk gabung grup diskusinya dapetin updat,""Eits list briefly announcement graduation, join our discussion group dapetin updat"""
24,sertifikat kompetensi yg diterbitkan aplikasi mitra diperkirakaan jutaan,certificate of competence which was published application diperkirakaan partners millions
25,udah masuk gelombang tpi evaluasi keburu abis nih kuota mantengin dashbord mulu,already entered TPI wave trigger evaluation abis nih mantengin quota dashboard mulu
26,semangat belajar ya kawan murid,students eager to learn ya friends
27,menyajikan materi pelatihan sesuai keahlian lembaga sejalan minat penerima kartu praker,presents the appropriate training material interests aligned organizational skills card recipient praker
28,tolong gimana ya sertifikat kunjung muncul dashboard selesaikan p,how ya certificate please turn up the dashboard finish p
29,selengkapnya,more
30,business wise mitra visioner pandemi ngi,wise business partners visionary pandemic ngi
31,penelitian terbaru dgn metode big data menyimpulkan sumber utama sentimen negatif pemerintah,The latest research concludes with methods of big data the main source of negative sentiment government
32,mohon dipertimbangkan asn golongan iii sarjana yg keterima pns pegawai l,please consider asn class of scholars who keterima pns iii employee l
33,anggota komisi iii dpr sari yuliati menilai keterlibata startup lokal program kartu prakerja kesempatan anak ban,dpr iii commission members sari Yuliati assess local startup keterlibata prakerja card program opportunities for children tire
34,anggota komisi iii dpr sari yuliati menilai keterlibata startup lokal program kartu prakerja kesempat,dpr iii commission members sari Yuliati assess local startup keterlibata prakerja card program kesempat
35,mari awasin ttg t mending jadiin blt masyarakat garis kemiskin,let awasin ttg t mending jadiin kemiskin line community blt
36,makan siang gratis potensi pendapatan anggaran negara yg dibelanjakan peserta program,free lunches state budget revenue potential program participants who spent
37,dana rp triliun kartu prakerja blt rakyat rakyat butuh makan pelatihan online he,rp trillion fund prakerja card blt folk folk online training he needed to eat
38,update jabar menko airlangga buruh pekerja migran phk masuk program kartu prakerja,jabar update airlangga coordinating minister dismissed workers migrant workers sign a card program prakerja
39,rakyat butuh makan pelatihan online hentikan kartu prakerja gantikan blt rakyat pk,people need to stop online training meal substitute prakerja card blt people pk
40,wakil ketua fraksi pks sukamta mengkritik kartu prakerja program sasaran asalan,deputy chairman of the faction px Sukamta prakerja card criticized arbitrary target program
41,dpp partai nasdem pelatihan online daring program kartu prakerja dihentikan,dpp party online training online NasDem prakerja card program is stopped
42,dpp partai nasdem pelatihan online daring program kartu prakerja dihentikan,dpp party online training online NasDem prakerja card program is stopped
43,salah tabiat warga mnrut berpura miskin mndptkn ssuatu yg bkn haknya sprti bbrp te,one poor habit pretend mnrut citizens that nothing retrieving his right not sprti some te
44,kartu prakerja salah janji kampanye jokowi dulunya didukung partai koalisi,prakerja wrong card jokowi campaign promises once supported the coalition parties
45,bantuan sekang pemerintah kanggo warga merga anane werna werna pisan kanggo sing ora keduman,assistance from the government to the people because he was color coding is to not take part in
46,gimana ya konten pelatihannya gak mematuhi persyaratan youtube gimana pelatihan,how ya do not comply with the requirements of the training content youtube how training
47,pa kartu prakerja delay trus kaum rebahan menerka nerka pen lulus,prakerja card pa delay uninformed guess then the lying pen pass
48,trid kursus online rekomendasi mincot keapus judulnya silakan dicek masi bingung mo ngambil kursus pake saldo ju,trid online courses mincot recommendations keapus title please check masi confused mo ju balance to take some courses use
49,program dinilai efektif menolong warga phk akibat pandemi presiden asosiasi serikat,program is considered effective to help the citizens dismissed union president of the association due to pandemic
50,pemerintah disarankan ubah program kartu prakerja bantuan langsung tunai,advised the government to change course prakerja card direct cash assistance
51,, 
52,, 
53,, 
54,, 
55,kartu prakerja salah janji kampanye jokowi dulunya didukung partai koalisi,prakerja wrong card jokowi campaign promises once supported the coalition parties
56,, 
57,gak kasih bintang kelas,not love Star Class
58,kartu pra kerja didesain situasi normal konsep pelatihan diterima kerja,pre-employment card designed normal situation received job training concept
59,gak kasih bintang kelas,not love Star Class
60,pendaftaran kartu prakerja dibuka kenali manfaat syarat pendaftarannya baca,prakerja card registration open registration requirement to recognize the benefits of reading
61,biang korupsi,a source of corruption
62,pemerintah disarankan ubah program kartu prakerja bantuan langsung tunai,advised the government to change course prakerja card direct cash assistance
63,indonesia puluhan negara gandeng coursera pelatihan online gratis korban phk,Indonesia dozens of countries articulated a free online training Coursera victims dismissed
64,ganti data akun prakerja ga ya daftar pekerja yg terikat kontrak besok,change account data prakerja ga ya register of workers' contract tomorrow
65,kemenaker rencana kedatangan tka cina,kemenaker planned arrival tka china
66,cairnya,melting
67,pemerintah memaksakan skema kartu prakerja dijalankan pandemi program dipersiapkan,prakerja card scheme to impose government run program prepared pandemic
68,tanggapan sri mulyani banyaknya kritik terkait program kartu prakerja,Sri Mulyani response to criticisms related to the card program prakerja
69,nasdem pelatihan daring kartu prakerja dihentikan via,NasDem prakerja card online training is stopped via
70,buntut pernyataan menko maritim said didu dipanggil bareskrim senin,maritime aftermath Coordinating Minister Said Didu statement called Criminal Monday
71,tanggapan sri mulyani banyaknya kritik terkait program kartu prakerja,Sri Mulyani response to criticisms related to the card program prakerja
72,fasilitasi pendaftaran kartu prakerja dpc pdi perjuangan kabupaten tapin buka posko,facilitation dpc pdi prakerja card registration districts struggle tapin open post
73,fasilitasi pendaftaran kartu prakerja dpc pdi perjuangan kabupaten tapin buka posko,facilitation dpc pdi prakerja card registration districts struggle tapin open post
74,ppsdm geominerba terverifikasi mitra program kartu prakerja inisiasi ppsdm geominerba menyelen,Verified geominerba PPSDM partners prakerja card program initiation PPSDM geominerba menyelen
75,orang dikampungku berkali kali daftar kunjung konteks,dikampungku people repeatedly visit list context
76,nasdem menilai program pelatihan daring kartu prakerja menimbulkan kegaduhan publik,NasDem assess prakerja card online training program raises public outcry
77,masyarakat coba coba mendaftar kartu pra kerja korban phk lolos,people try try registering a pre-employment card dismissed victim escapes
78,khusus pemegang pelatihan online gratis part ppsdm migas,Special holders free online training part-oil PPSDM
79,saran ahy duit kartu pra kerja dialokasikan bantuan langsung,ahy advice card pre-work money allocated direct aid
80,program dinilai efektif menolong warga phk akibat pandemi presiden asosiasi,program is considered effective to help residents association president dismissed due to pandemic
81,ppsdm geominerba terverifikasi mitra program kartu prakerja inisiasi ppsdm geominerba,Verified geominerba PPSDM partners prakerja card program initiation PPSDM geominerba
82,pendaftaran kartu prakerja dibuka kenali manfaat syarat pendaftarannya baca,prakerja card registration open registration requirement to recognize the benefits of reading
83,menemukan pilihan menu,find menu options
84,udah seminggu serti akun praker nya blm muncul insentif cair akun nya udh,already a week certi his praker account p appears his account liquid incentives UDH
85,saran ahy duit kartu pra kerja dialokasikan bantuan langsung,ahy advice card pre-work money allocated direct aid
86,b pola en gerombolan merekayasa menjarah via tipuan emang disetujui komp,b en gang manipulating patterns loot via indirection weve been approved comp
87,guys peserta kartu prakerja yg uda nerima saldo gabung grup yu manfaatin saldo sejuta pemerintah semaksi,Participants guys who uda accept prakerja card balances yu group join manfaatin million government balance semaksi
88,t,t
89,jum at semangat mencari pelatihan prakerja memilih pelatihan prakerja studilmu,jum at the spirit of seeking training prakerja choose prakerja training studilmu
90,dihebohkan mekanisme pemilihan platform digital mitra resmi pemerint,dihebohkan digital platform selection mechanism authorized partners pemerint
91,rutin pelatihan memancing scr online kucing kucing menyenangkan tid,scr online training routine cat fishing fun tid
92,perusahaan rintisan startup alias unicorn gojek traveloka menolak mitra program kartu pra kerja kena,alias startup startups unicorn gojek traveloka reject a pre-employment program partner contact card
93,, 
94,realisasi program kartu pra kerja,the realization of a pre employment program
95,, 
96,, 
97,, 
98,, 
99,realisasi program kartu pra kerja,the realization of a pre employment program
100,, 
101,, 
102,, 
103,, 
104,halo kak udah lolos bingung pake kartu prakerja nya hubungi no ya kak baka,hello kak already escaped confused prakerja card use his contact no yes kak baka
105,yuk simak faq kartu prakerja seputar penerimaan insentif kelas pelatihan saldo pendafta,let's see about the reception prakerja card faq incentive balance training classes pendafta
106,selamat lolos pendaftaran kartu prakerja gelombang gimana udah membeli kelas incara,congratulations card registration prakerja wave passes already purchased the class how incara
107,thread dibikin sesuai bidang kerja mincot kasih nama kursusnya komentar kursusnya harga kursus da,contrived thread corresponding work plane mincot love tutoring comment tutoring name price da courses
108,kebanyakan kartu smart dikit napa,Most smart cards little napa
109,duit rp triliun kartu prakerja jual beli video tutorial,rp trillion money prakerja card purchase video tutorials
110,kendala menghubungi via email info telp semoga membantu,constraints contacted via email the info tel hopefully help
111,membantu pencari kehilangan pekerjaannya dampak pandemi,help searchers lost his job impact of a pandemic
112,karyawan kena phk rakyat butuh kerja disuguhkan,employee severance of contact with the people need work presented
113,duit rp triliun kartu prakerja jual beli video tutorial,rp trillion money prakerja card purchase video tutorials
114,duit rp triliun kartu prakerja jual beli video tutorial,rp trillion money prakerja card purchase video tutorials
115,duit rp triliun kartu prakerja jual beli video tutorial,rp trillion money prakerja card purchase video tutorials
116,, 
117,hadeeuuhh anis byarwati komen gini biar manfaatin polemik,anis hadeeuuhh byarwati gini let manfaatin polemic comments
118,teman teman yg lulus kartu prakerja gelombang yg on progres gelombang yg ambil pelatihan,friends who passed prakerja card that wave on wave of progress that take training
119,ameliarianaa woww respect salut t,ameliarianaa health Woww respect t
120,buka prakerja kaya gini,prakerja open kaya gini
121,teman teman yg lulus kartu prakerja gelombang yg on progres gelombang yg ambil p,friends who passed prakerja card that wave on wave of progress that take p
122,information yg valid langsung join us yah,valid information which directly join us well
123,buruh soroti phk massal batalkan kartu prakerja,Mass termination highlight labor card canceled prakerja
124,teman yg pengen tau seputar prakerja join grup yaa,friends who want to know about the yaa prakerja join group
125,next wrong from istana negara ri,next wrong from istana negara ri
126,inti pelatihan online utk peserta via start up adlh knp peserta hrs beli videonya uangnya dr,For the core online training participants via start up adlh knp participants hrs money buying video dr
127,layak program pemerintah dibiayai apbn rp t riil cost nya diestimasi tdk rp m moga,decent government programs financed by the state budget rp t its real cost was estimated morbidly rp m hope
128,, 
129,lolos gelombang prakerja,wave passes prakerja
130,kursus bukalapak membantu prakerja mema,bukalapak courses help prakerja mema
131,gimana ya konten pelatihannya gak mematuhi persyaratan youtube gimana pelatiha,how ya do not comply with the requirements of the training content youtube how pelatiha
132,bingung nyari kursus intip intip aja bukalapak harganya ribu looh,peep peep confused to find a course just bukalapak cost thousands LOOH
133,main main kesini just sharing kasih masukan seputar yuk join,play play here just sharing the love feedback on yuk join
134,kursus murah utk program kartu prakerja rekomended yaa buka lapak aja,For courses cost prakerja card program rekomended bukalapak yaa aja
135,sharing sharing seputar whatsapp me,sharing sharing around whatsapp me
136,ngantuk gak konsen semoga gak kelewat yah,ngantuk not concerned hopefully not too well
137,temen yg uda lulus kartu prakerja nerima saldo sejuta ga paham gunain saldo,temen yg uda pass prakerja card balances to accept a million ga understand gunain balance
138,program nyari kursusnya harga ribu,nyari tutoring program price thousand
139,terjangkau harganya,affordable
140,, 
141,buka lapak top kursus enak ajaaa dibuka lapak yu butuh,bukalapak top ajaaa tasty courses opened shanties yu need
142,telusuri minatmu cari kursus cocok ayo buruan intip daftar,browse your interests find suitable courses let game voyeur register
143,udah gelombang dicek berasa ngecek wa yg ngga bls karna lg ngambek yg nyaki,wave already checked checked wa taste that guns bls lg cranky because that nyaki
144,k skill mantap banget bukalapak,k skill steady buildup bukalapak
145,gimana sulit melewati min gini gini aja nomor bni tdk bri,how difficult past gini gini aja min bni indeterminate number bri
146,emang gk ya bank bni,weve gk ya bank bni
147,meluncur terjangkau harganya,glide affordable
148,bukalapak keren info yg bermanfaat dibutuhkan,Cool bukalapak helpful info who needed
"149,wow kursus bayar ribu sih murah banget lho kualitasnya buruan join,""wow courses really pay thousands of cheap anyway, you know the quality of game join"""
150,kursus murah program kartu prakerja buka aja buka lapak,Cheap courses open prakerja card program just bukalapak
151,salut buka lapak,salut bukalapak
152,harga segitu skill so tunggu,price that much skill so wait
153,nih,nih
154,coba deh,try deh
155,pilih pelatihan pra kerja,select a pre-employment training
156,daftar pra kerja noh ikuti caranyaa,pre-employment list noh follow caranyaa
157,yuk yg udah lolos seleksi beli kursusnya keren lho programnya,yuk who already passed the selection and purchase the course is pretty cool program
158,keren banget ribu perak dpt skill hayoo yg bingung m,cool thousand silver interchangeable skills that confused hayoo m
159,gausah kalo udah cari kursusnya bukalapak terima kasih,gausah if already find the course bukalapak thanks
160,cuss deh bukalapak kursus harga terjangkau,deh cuss bukalapak course affordable prices
161,d buka lapak kursus murah ayoo buruan bukalapak,d bukalapak cost Pligg game courses bukalapak
162,wahh harga terjangkau udah dapet skill patut dicoba nih,wahh affordable prices already get a skill worth a try nih
163,kampanye,campaign
164,nyari kursus lengkap murah ya bukalapak,nyari complete course cost ya bukalapak
165,kursus bukalapak terlengkap termurah mantul,bukalapak courses lowest complete mantul
166,semoga program berjalan sukses,I hope the program was a success
167,wihhh mantap nih bukalapak,wihhh steady nih bukalapak
168,keren dgn rb dapet skill,Cool with rb dapet skill
169,kursus ya bukalapak aja lengkap murah,aja ya bukalapak complete course cost
170,pks keras kritik pemerintah jutaan korban phk corona ladang proyek kartu prakerja,pks harsh government criticism of millions of victims dismissed the corona field prakerja card project
171,salah satuny terobosan dunia usaha industri jasa pningkatan skil calon kryawan,one satuny breakthrough business services industry pningkatan skil candidate kryawan
172,ide bagus nih,great idea ya
173,ga ngerti dah gimana mantan mentri dapet bantuan semi sosial,dah not understand how the former minister semi dapet social assistance
174,kursus harganya terjangkau bukalapak,affordable courses bukalapak
175,kursus ya,of course yes
176,wahh murah banget nih meluncur daftar,Cheap wahh nih sliding register
177,silahkan teman teman bermanfaat lumayan menambah pengalaman,Please helpful passable friends adds to the experience
178,wahhh keren nih bukalapak,Cool wahhh ya bukalapak
179,dasboard akun pra kerja sya stlah login udh seminggu aja tolong yg bs bantu jelasin ms,dashboard account pre-employment companies stlah already logged a week do please help explain that bs ms
180,waww oke min meluncurrr,waww okay min meluncurrr
181,menarik nih nambah skill,adds an interesting ya skill
182,mantap banget nih buruan ikutan bayar kursus k kuyy bukalapak,steady nih pay prey follow the course k kuyy bukalapak
183,keren bukalapk pelatihan skill harga ribu aja,Cool skill training bukalapk price thousand aja
184,mantap ni kemarin udah daftar in kursus bukalapak,ni steady yesterday already register in the course bukalapak
185,pejabat negara layak dikenai sanksi dicopot dr jabatan dihukum pidana skandal program,decent state officials sanctioned post of convicted criminal was stripped dr program scandal
186,wihh murah banget dicoba nih,Cheap wihh really try nih
187,mantap nih kursus murah bukalapak gampang deh kursus bidang kesukaan,bukalapak nih's steady course easy deh A field course
188,waaah keren bermanfaat infonya thanks bukalapak,waaah helpful cool the info thanks bukalapak
189,murah banget yuk yg daftar langsung aja,really cheap yuk who register immediately wrote
190,baiknya mengikuti langkah yg inggris duit dihambur,The good followed the steps that English money scattered on the ground
191,mantap banget ya skill harga terjangkau bangett ayo buruan,really yes steady skill affordable prices bangett let hunted
192,pejabat negara layak dikenai sanksi dicopot dr jabatan dihukum pidana skandal pr,decent state officials sanctioned post of convicted criminal was stripped dr pr scandal
193,daftar kartu pra kerja ah,a list of pre-employment card ah
194,makasih yg tlah bantu yg dpt umtuk kursus skill online murah,Wherever that thanks auxiliary umtuk pervasive skill courses online cheap
195,keren sihhh,cool sihhh
196,lu see uang rakyat t program sampah,lu t see public money trash program
197,harga murah skillnya gak murahan wow,Cheap prices not cheap wow skillnya
198,mantap harga terjangkau skill mantap,steady skill affordable prices steady
199,kursus bukalapak harganya terjangkau,bukalapak affordable courses
200,kuy buruan daftar man teman,Kuy hunted man list of friends
201,membantu banget nih,help nih
202,yuk buruan langsung buka aja bukalapak,let's open the game immediately wrote bukalapak
203,parah sih murah bgt,Cheap heck severe bgt
204,harganya murah kualitasnya bagus,cheap price good quality
205,wahh bagus banget nih harganya terjangkau,nice wahh affordable nih
206,mantap banget bukalapak tau kursus aja dipilih pengguna,steady buildup bukalapak tau wrote a user-selectable courses
207,murah ya daftar bukalapak skill kuy ah daftar,Cheap yes ah Kuy skill bukalapak list register
208,solusi menyelesaikan lapangan pekerjaan,complete solutions jobs
209,coba tuh tau berhasil,try tuh tau succeed
210,bener banget harganya murah terjangkau,Ko's really affordable price
211,keren kursus murah loh bukalapak k kuy ikutan,Cool cheap tablets courses bukalapak k Kuy followup
212,kursus ya tempatnya harganya muraaaaah,yes course where the price is muraaaaah
213,mantap kali nih harga terjangkau dapet skill terbaru,the steady times nih affordable prices dapet latest skills
214,wahh mantap nih lockdown dirumah aja wajib dicoba nih kursus terlengkap termurah buka,wahh home lockdown steady nih nih aja must try lowest complete courses open
215,cobain nih memiliki skill sesuai kemampuan kursus kali,cobain ya have the appropriate skills courses abilities times
216,wahh sih murah banget keren nih bukalapak adain kursus prakerja yuk akhh langsung kepoin,wahh's really cool heck ya bukalapak adain prakerja course yuk direct akhh kepoin
217,wahhh nyari kursus lengkap bukalapak udah murah skill guys,wahhh nyari complete course bukalapak already cost skill guys
218,rekomendasi banget nih,recommendation nih
219,kursus bukalapak yuk lgsg coba daftar murah lengkap nambah ilmu krna bnyk skill baruu,bukalapak course lgsg yuk's try a complete list adds science skills krna bnyk baruu
220,wow ya kursus murah rb ya pastinya cepat kerjaan,wow cheap Courses rb yes yes fast course work
221,keputusannya anggaran program programnya b,b program budget decision program
222,kursus kartu prakerja buka lapak murah dapet skill keren bangetttttt buka lapak,courses prakerja card's bukalapak dapet cool skill bangetttttt bukalapak
223,kursus ya aja gampang membantu anggota nya buruan kes,aja ya courses easily help its members hunted case
224,hah kursus murah gak percaya yuk cek bukalapak jarng loh kesempat,hah-cost courses do not believe yuk check bukalapak netting tablets kesempat
225,terima kasih meluangkan kursus cinta buka lapak murah hemat pengala,thanks for taking the courses cost saving love bukalapak pengala
226,kursus aja dibuka lapak,aja course opened shanties
227,wii keren harga murah manfaatnya gede banget,Cool wii low price really big benefits
228,kesempatan emas bg yg muda utk meningkatkan skill ayo jgn ketinggalan bukalapak,bg young golden opportunity that let jgn For improving skills lag bukalapak
229,semoga membantu anggota pemengan semoga dimamfaatkan,hopefully may help member pemengan dimamfaatkan
230,kursus murah until bukalapak,Cheap courses until bukalapak
