,0,translate
1292,pemerintah ngotot jalankan kartu pra kerja senua sdh protes keras,government insist on pre-work run senua SDH cards outcry
1293,biayanya apbn yg mil,which will cost the state budget miles
1294,kartu pra kerja bertujuan mengajarkan skill pencari kerja pns berusaha atasan,pre-employment card aimed at teaching skills of job seekers civil servants trying to boss
1295,pengen latihan memancing nganggo kartu pra kerja,wanna exercise fishing with prepaid cards work
1296,nambahin polemik kartu pra kerja ah tes gel pas barusan dibuka langsung suruh tambahin rekening ok,nambahin card polemic pre-employment test ah gel pas recently opened a direct order add the account ok
1297,kasih,love
1298,negara iakan lapangan kerja negri harapan raih kehidupan lbh berujung pd ketidakjelasan brp b,state employment iakan country to achieve life expectancy lbh endless obscurity BRP b pd
1299,yg rp rp gak hubungan,rp rp yg gak relationship
1300,loh kartu pra kerja kampanye lo or,loh lo card or pre-work campaign
1301,iklan iklan nya seperi jualan tutorial paket combo sesuai saldo kartu pra kerja juta git,Her advertisement advertisement combo pack are like selling tutorial appropriate pre-employment million card balance git
1302,pemerintah ngeluarin kartu pra kerja salah insentif nya pelatihan platform digital sa,ngeluarin government incentive card of his pre-employment training one digital platform sa
1303,dipuja puji laksana khalifah umar dgn bantuan lempar langsung pas ditagih kewajiban pasal uu no,Praise revered Caliph Umar exercise with the help of a throwing passes directly charged uu no obligation article
1304,kartu pra kerja,pre-employment card
1305,sistem ruang guru yg sdh,sdh system teachers' room
1306,fotoin om tau jd rekomendasi mancing ala kartu pra kerja,fotoin om tau jd card-style fishing on a pre-employment
1307,keputusan menjalin kemitraan start up kartu pra kerja keliru simple they don t have r,decisions partnership pre-employment start-up cards simple mistaken they don t have r
1308,anggaran kartu pra kerja drpd diarahkan utk pelatihan online yg arahnya nggak menguntungka,cards pre-employment budget drpd For online training that directed him not menguntungka
1309,dpr program kartu pra kerja pengawasan ketat melekat,pre-employment program dpr cards strict supervision attached
1310,bro e ktp diungkap pemerintahan sby pelakunya kakap,bro e ktp sby government revealed the culprit snapper
1311,intensif kartu pra kerja aja ya lengkapnya,pre-employment intensive aja card full
1312,provinsi riau ajukan kartu pra kerja buruh phk akibat covid,Riau province submitted a pre-employment card workers dismissed as a result of covid
1313,kalo pembiayaan covid utang anak cucu bayar cicilan utang nya t bln kenap,covid debt financing if children and grandchildren pay its debt repayments t bln kenap
1314,yth sy memahami lelah mengurus bangsa mohon jgn tambahi lelah dgn membiarkan p,Dear sy tired of taking care of the nation's understanding jgn please add weary with letting p
1315,insentif pajak kartu pra kerja mitigasi covid,pre-employment tax incentive cards mitigation covid
1316,in depth research oke ditambah kunci abadi diincee penyumbang traffic rutin a,in depth research okay plus key contributor lasting diincee a routine traffic
1317,sblm pandemi covid isu ketenagakerjaan msh menyisakan permasalahan hak buruh mencermati relevansi dana,Prev pandemic covid labor issues msh labor rights watch has problems relevance funds
1318,insentif pajak kartu pra kerja mitigasi covid pemeri,pre-employment tax incentive card mitigation covid government
1319,ekonomi ri berpotensi titik nol keputusan government bonds money enginering mela,ri economic potential to the zero point of decision-engineering government bonds money mela
1320,, 
1321,semoga angkat perihal polemik program kartu pra kerja,hopefully lift polemic concerning pre-employment card program
1322,habiburokhman heran kartu pra kerja bikin pempek bayar rp ribu,Habiburokhman wonder pempek make a pre-employment card pay rp thousand
1323,gausah berharap negara gak usaha pns bikin kartu pra kerja,gausah expect state civil servants do not attempt to make a pre-employment card
1324,rezim penipu ngasih lapangan krja tka berjuta ksh rakyat kartu pra kerja ngibul,regime scammers give the Near tka ksh millions of cards pre-employment rear
1325,cm adakah kenalan keluarganya penerima kartu pra kerja butuh responden kuisioner magangku kome,is there a family acquaintance cm card recipient need a pre-employment questionnaire respondents apprenticeship kome
1326,rocky gerung kartu pra kerja buang buang anggaran prabowo terpaksa ambil alih,growled rocky pre-employment cards a waste of budget prabowo forced to take over
1327,salah sasaran sm holes nya emg gw gabuka programnya cm dr opini org materinya sen,one of his goals holes EMG sm gw dr cm gabuka program material org opinion cents
1328,yg framing nembak ruangguru kaitkan,who framing shoot associate ruangguru
1329,kartu pra kerja nyasar miris,sad stray pre-employment card
1330,dilema,dilemma
1331,link,link
1332,skrg bertambah lembaga pelatihan m,skrg increase training institutions m
1333,kau pra kerja mah kampanye,you pre-work campaign mah
1334,platform yg gak model platform market,yg gak platform market platform model
1335,sih silahkan org org berpendapat berbeda,anyway please org org different opinion
1336,selamat nikmati pelatihan program kartu pra kerja biar korban phk massal cepat kenyang,enjoy congratulations card pre-employment training program so that victims of mass dismissed early satiety
1337,baca ginian nyumpah nyumpahin org yg terlibat kartu pra kerja kzl,read ginian curse dishevel person involved pre-employment card kzl
1338,mendaftar,sign up
1339,kartu pra kerja yg modul pelatihan,card that pre-employment training modules
1340,kartu pra kerja pelatihan,card pre-employment training
1341,surat ceo amaha gak hubungannya kartu pra kerja off side,ceo letter amaha not do pre-employment card off side
1342,pagi pendidikan nasional bole banget mengkaji kartu pra kerja yg mengharuskan dana yg,national education morning bole really reviewing a pre-employment card that requires that funds
1343,spsi jatim tolak kartu pra kerja usulkan program cash and carry uang tunai buruh,SPSI jatim card reject a pre-employment program proposed a cash and carry cash laborers
1344,tny anggota dpr komisi peran kpk mrk yg sy sbg awam hukum sih jg men,tny dpr member commission that mrk kpk role as a lay sy jg anyway law shortly
1345,harpenas dirayakan golkar stafsus bancakan program pelatihan kartu pra kerja c,Golkar celebrated harpenas stafsus bancakan card pre-employment training program c
1346,kartu pra kerja isinya buzzer smua duga,pre-employment card contents buzzer smua suspect
1347,pemprov jabar usul pelatihan online kartu pra kerja diganti bantuan langsung tunai buruh,jabar provincial origins pre-employment training replaced the card online cash aid workers
1348,rocky gerung kartu pra kerja buang buang anggaran prabowo terpaksa ambil alih,growled rocky pre-employment cards a waste of budget prabowo forced to take over
1349,ayo nasdem diam dgn sewenang wenang rezim tolak perppu no thn tolak omnibus law tolak tka,Let NasDem silent starting with arbitrary regime regulation has no omnibus law yrs reject reject tka
1350,kartu pra kerja tp yg kerja tka china,pre-employment card tp who work tka china
1351,kartu pra kerja tp yg kerja tka china,pre-employment card tp who work tka china
1352,lolos pelatihan kartu pra kerja aktor,pass the pre-employment training actors card
1353,seniman jogja kartu pra kerja skandal jokowi ditipu anak,pre-employment card Jogja artists scandals defrauded child jokowi
1354,than do kartu pra kerja i mean k each day is better to buy food than nothing paid at all,than do kartu pra kerja i mean k each day is better to buy food than nothing paid at all
1355,kartu pra kerja tp yg kerja tka china,pre-employment card tp who work tka china
1356,kursus kerja kartu pra kerja tp yg kerja tka china,pre-employment courses card works tp who work tka china
1357,rocky gerung kartu pra kerja buang buang anggaran prabowo terpaksa ambil alih,growled rocky pre-employment cards a waste of budget prabowo forced to take over
1358,kartu pra kerja tp yg kerja tka china,pre-employment card tp who work tka china
1359,kartu pra kerja bro,pre-employment card bro
1360,mudah mudahan covid menyadarkan presiden bhw manusia bangunan pendidikan kesehatan p,hopefully covid sensitize human bhw president of health education building p
1361,nih modus pelaku kartu pra kerja simak penjelasan mas agustinus garong,ya card mode pre-work actors see explanation mas Augustine robber
1362,orang operasional kantor kalo gabut suka bawa bahan bikin pelet umpan mancing diracik kadang b,the office operations if gabut Like material brought to make fishing bait pellets formulated sometimes b
1363,kartu pra kerja mutlak hrs diawasi krn uang negara hg rp t th melibatkan vendor yg berpotensi,pre-employment card hrs supervised absolute krn hg state money rp t th involve vendors who potentially
1364,tka kerja pribumi kartu pra kerja,tka card indigenous pre-employment work
1365,sertifikat kartu pra kerja kayak klinik tongfang auto auto gitu,pre-employment card certificate Tongfang auto auto kayak clinic so
1366,semoga menambah,may add
1367,pelatihan kartu pra kerja,pre-employment training card
1368,dikirain kartu pra kerja gratis pelatihan pempek doaang ribu pelatihan online kelas i,dikirain card free pre-employment training pempek doaang thousands of online training class i
1369,gw kartu pra kerja cash ambil tgl sekian sprt pkh ribed ya jd rakyat jelata,gw pre-employment card cash grab so sprt CCT date ribed yes jd rabble
1370,maksudnya kartu pra kerja kalik yhhh,pre-employment card means kalik yhhh
1371,kartu pra kerja,pre-employment card
1372,kartu pra kerja dikasih nonton video pemerintah gak bikin akun youtube menghemat anggaran dapet duit,pre-employment card given the government not make watching video youtube account get money saving budget
1373,saran ahy duit kartu pra kerja dialokasikan bantuan langsung,ahy advice card pre-work money allocated direct aid
1374,tka langsung kerjaan warga kartu pra kerja kagak tau dpt k,direct tka card pre-employment work of citizens have not understood interchangeable k
1375,warga sumut terdampak covid phk dirumahkan pencari kerja,sumut residents affected job seekers housed dismissed covid
1376,kelewatan goblok klo yg belain gila,Stand miss that crazy fool Klo
1377,jir dituduh gw giring opini publik f,floods accused my sleigh public opinion f
1378,publik terfokus ulah mantan stafsus milenial kartu pra kerja rp t eh yg terlewat bi sdh kucurkan quantitat,public focused act of the former pre-employment stafsus card millennial rp t er who missed bi SDH drizzle Quantität
1379,pingin nyobain ngulik kartu pra kerja ah dagelan ya wkwkwk kocak ah t gituan d,I want to try studying a pre-employment joke ah ah yes wkwkwk funny t d nookie
1380,kekurangan ya tp busuk gak kartu pra kerja yg transparan sdh kusampaikan istana,yes tp foul shortage card not transparent SDH pre-work that I delivered palace
1381,belio usul program kartu pra kerja dibatalkan dananya u,Belio proposal canceled a pre-employment program funds card u
1382,dpr kartu pra kerja relevan diterapkan corona,dpr relevant pre-employment card applied corona
1383,seep gw kasihan,I pity seep
1384,pake kartu pra kerja,card use pre-employment
1385,kasih mas kartu pra kerja minim manfaat mudhaaratnya berhenti du,love mas card minimal pre-work benefits mudhaaratnya stops du
1386,materi kartu pra kerja,material pre-employment card
1387,pemain bal balan yg nganggur fifa kartu pra kerja pemain,bal balan idle players who pre-employment fifa player card
1388,mohon tanggapannya terkait polemik kartu pra kerja konflik kepentingan dgn ruang,please response card polemic pre-work related conflicts of interest with space
1389,pelatihan melamar kerja corona behahaha lamar kerja dimana kerjaan kagak,a job training behahaha applying corona workplaces where work kagak
1390,politikus pks amin ak presiden jokowi batalkan program pelatihan berbayar penerima kartu pra kerja mengalihk,ak amin px politician president paid training program jokowi cancel a pre-employment card recipient mengalihk
1391,kemana aja bu khabar kartu pra kerja gak dilibatkan ya proyek t,where aja bu khabar pre-employment card not included yes projects t
1392,kebijakan yg lakukan program kartu pra kerja sembako mempercepat omnibus law tuntutan buruh sa,policies that do pre-work card program groceries accelerate omnibus labor law demands sa
1393,tumben pintar wkwkwk tau kau liat aja sistemnya gmana orang desa dpat bantuan kartu pra ker,wkwkwk smart tumben know you watch as the system gmana dpat help villagers were pre ker
1394,kartu pra kerja gak sasaran buang uang aja menguntungkan pelati,pre-employment card not waste money just profitable target pelati
1395,karyawan dirumahkan program kartu pra kerja,employees laid off card pre-employment program
1396,nunjukin kartu pra kerja br diskon ato member ojol,show business card pre br discounts or member Ojol
1397,saran ahy duit kartu pra kerja dialokasikan bantuan langsung,ahy advice card pre-work money allocated direct aid
1398,coba bro silri ngadu sukur sepeda ato gak kartu pra kerja aja pili,try bro bike sukur silri ngadu pre-employment ato gak aja card pili
1399,jgn retorika buktikan kartu pra kerja selidiki,jgn rhetoric prove pre-employment card probe
1400,seett jetii buka loker tkc berjuta giliran rakyat dikasi kartu pra kerja pempek sam,Pier seett open locker TKC millions of people turn card gave pre-employment pizza sam
1401,politikus pks amin ak presiden jokowi batalkan program pelatihan berbayar penerima kartu pra kerja,ak amin px politician president paid training program jokowi cancel a pre-employment card recipient
1402,negara iakan lapangan kerja negri harapan raih kehidupan lbh berujung pd ketidakjelasan,state employment iakan country to achieve life expectancy lbh endless obscurity pd
1403,ga setuju msh batalkan kartu pra kerja uber dana yg dikorupsi koruptor,ga agree msh cancel a pre-employment card uber funds that corrupted corruptors
1404,, 
1405,, 
1406,rocky gerung kartu pra kerja buang buang anggaran prabowo terpaksa ambil alih,growled rocky pre-employment cards a waste of budget prabowo forced to take over
1407,kpk usut tuntas kartu pra kerja bgm kawan,kpk usut complete a pre-employment card bgm friend
1408,karyawan dirumahkan program kartu pra kerja,employees laid off card pre-employment program
1409,kabar gembira kartu pra kerja gelombang dibuka daftar rp juta,the good news of a pre-employment card opened wave rp million list
1410,selamat mencoba mudah praktis konkrit ga ribet daftar kartu pra kerja,good luck with concrete practical easy ga complicated pre-employment card list
1411,dukung konten pra kerja bang mencerdaskan anak bangsa anak,support pre-employment content bang educate the children of the nation Child
1412,lucu ketua yg,funny chairman reply
1413,, 
1414,aneh ya pemimpin negara kadin bilang tenaga kerja phk eh peja,Kadin's strange state leaders said workers dismissed eh peja
1415,sdh jt yg phk tetep kerja berpenghasilan bgmn program kartu pra kerja senilai t nggak keny,sdh who dismissed tetep jt-income working as never before pre-work card program worth t dont 'u
1416,haloo sobat hukum informasi manfaat kartu pra kerja digagas pemerintah pandemi covid,haloo buddy card information law pre-work benefits the government initiated a pandemic covid
1417,kartu pra kerja sifatmya udah pure pelatihan dimasa pandemic,sifatmya card already pre-employment training puree future pandemic
1418,salah kejanggalan program kartu pra kerja sertifikat pelatihan diikuti ditandatangani o,any irregularities card program followed a pre-employment training certificate signed o
1419,covid kemiskinan ketidakmampuan finansial bentuk orang hotel m,poverty covid financial inability m form the hotel
1420,situ yg dukung rezim edan berkuasa bab coba ccin salah penikmat,there who support the regime in power wacky chapter ccin try one connoisseur
1421,caloooon calon pake kartu pra kerja nihh,caloooon card use pre-employment candidates nihh
1422,koreksi teruslah berharap kartu pra kerja,correction keep wishing card pre-employment
1423,iyah kondisi dampak wabah kartu pra kerja bom pes,Iyah condition pre-employment impacts bomb card outbreak of bubonic
1424,mba gak rencana kupas tuntas kartu pra kerja ya,mba not plan a pre-employment card completely peeled yes
1425,rocky gerung kartu pra kerja buang buang anggaran prabowo terpaksa ambil alih berita,growled rocky pre-employment cards a waste of budget prabowo forced takeover news
1426,kartu pra kerja aja gabisa akses boro daftar liga dangdut makan aja susah,pre-employment card aja boro access gabisa league list dangdut eat just hard
1427,blt buruh kartu pra kerja,blt pre-work laborers card
1428,anis byarwati anggaran rp t kartu pra kerja dialihkan bansos jutaan buruh korban phk,anis byarwati t rp budget pre-employment card bansos diverted millions of workers dismissed victims
1429,pengusutan tuntas skandal pelatihan pra kerja kocak pelatihan mancing masuk program kartu prak,investigation thorough pre-employment training scandal hilarious fishing training program entry card crunch
1430,polemik pelatihan medioker ruang guru en kartu pra kerja keoknya gig economy macem gojek etc d nasa pandemic s,polemic mediocre training en teachers' lounge gig card keoknya pre-employment economy gojek macem nasa pandemics etc d s
1431,bro e ktp diungkap pemerintahan sby pelakunya,bro e ktp sby government revealed the culprit
1432,blt buruh kartu pra kerja,blt pre-work laborers card
1433,kena masyarakat yg butuh langsung mesti audit program kartu,Direct contact with people who need a card program must audit
1434,postingan ttg penerapan program kartu pra kerja sdh ingatkan dgn keras lakukan modifikasi m,ttg post card application a pre-employment program SDH harshly reminded to do modifications m
1435,pengusutan tuntas skandal pelatihan pra kerja,investigation thorough pre-employment training scandal
1436,dana triliunan dipersiapkan kartu pra kerja menkritisi kebijakan yg bermanfaat merugika,trillions of pre-prepared cards that policy menkritisi useful work merugika
1437,pengusutan tuntas skandal pelatihan pra kerja,investigation thorough pre-employment training scandal
1438,salah dimana yah mend,one where yah mend
1439,rocky gerung kartu pra kerja buang buang anggaran prabowo terpaksa ambil alih,growled rocky pre-employment cards a waste of budget prabowo forced to take over
1440,platform mendaftar p,register platform p
1441,selamat mencoba mudah praktis konkrit ga ribet daftar kartu pra kerja,good luck with concrete practical easy ga complicated pre-employment card list
1442,rocky gerung kartu pra kerja buang buang anggaran prabowo terpaksa ambil alih,growled rocky pre-employment cards a waste of budget prabowo forced to take over
1443,kartu pra kerja dapet juta orang rinciannya kayak gambar dibawah,pre-employment dapet card details of millions of people like the image below
1444,yg nyobain filter videocall line trs move zoom eh bahas pro kontra kartu pra kerja lha roleplay ked,nyobain filter which line videocall move the zoom eh trs discuss pros and cons of a pre-employment card LHA ked roleplay
1445,selengkapnya,more
1446,kayaknya mementingkan efektivitas akurasinya lebi,I think accuracy is concerned with the effectiveness of grama
1447,rocky gerung kartu pra kerja buang buang anggaran prabowo terpaksa ambil alih,growled rocky pre-employment cards a waste of budget prabowo forced to take over
1448,yg nyobain filter videocall line trs move zoom eh bahas pro kontra kartu pra kerja lha rolepla,nyobain filter which line videocall move the zoom eh trs discuss pros and cons of a pre-employment card LHA rolepla
1449,agustinus edy kejanggalan kartu pra kerja ruangguru angkat bicara cc,Augustine edy irregularities pre-employment card ruangguru spoke cc
1450,kartu pra kerja emang wajar diusut gak ngomongin market leader keputusan kartu pra kerja lolos aja,reasonable pre-employment card weve investigated not talking about a market leader escaped a pre-employment card decision aja
1451,amin ak program pelatihan pendompleng kartu pra kerja dibatalkan,ak amin pendompleng training program pre-employment card canceled
1452,beresin kartu pra kerja om ngemeng laen,beresin pre-employment card om ngemeng laen
1453,ceo media daring agustinus edy kristianto merespons penjelasan ruangguru terkait jenis sertifikat dikeluarkan skil,edy online media ceo Augustine responded kristianto ruangguru explanation about the type certificate is issued skil
1454,menurutku kartu pra kerja ki program bagus sih momen mencari kerja ki ra mulus sesuai ha,I think pre-labor card great program ki heck moment looking for work seamlessly matches ha ra ki
1455,saran ahy duit kartu pra kerja dialokasikan bantuan langsung,ahy advice card pre-work money allocated direct aid
1456,nih modus pelaku kartu pra kerja simak penjelasan mas agustinus garong,ya card mode pre-work actors see explanation mas Augustine robber
1457,kartu pra kerja rame rame disuruh batalin ya kali skrg diributin yg program udh kabur tuh dana b,pre-employment card rame rame told batalin yes times skrg diributin who fled tuh udh program funds b
1458,drpd t diskon paket kartu pra kerja mending massive tes corona gratis,drpd t discount card packs a pre-employment test corona massive mending free
1459,kartu pra kerja latihan jebakan tokek,pre-employment card trap exercise gecko
1460,syarat tata kartu pra kerja,requisites of a pre-employment card
1461,dpp knpi menolak sistim kartu pra kerja krn diduga bancakan menjamin peser,dpp KNPI reject a pre-employment card system krn allegedly bancakan guarantee mites
1462,yo muspro bwang ntar kaya hambalang skala prioritas ya rasional sih kalo ane me,yo muspro bwang rich ntar hambalang rational priorities hell yes if ane me
1463,orok gua udah diajak melaut alm ayah sekolah sd smp sma libur kuliah gua ngikut manc,snore cave already invited to sail late father sd smp sma school holiday adherents college cave manc
1464,training berbayar utk pemegang kartu pra kerja tah mas,For cardholders paid training pre-employment tah mas
1465,dpp knpi menolak sistim kartu pra kerja krn diduga bancakan menjamin,dpp KNPI reject a pre-employment card system krn allegedly bancakan guarantee
1466,kartu pra kerja skandal jokowi ditipu anak,pre-employment card scandals defrauded child jokowi
1467,dpr memanggil presiden kartu pra kerja tka china ya perwakilan r,dpr calling the president a pre-employment card tka china yes representation r
1468,fyi pemb ibukota apbn total biaya sisanya kpbu karo pendanaan swasta men,fyi pemb total cost of the revised state capital remaining men kpbu karo private funding
1469,orang operasional kantor kalo gabut suka bawa bahan bikin pelet umpan mancing diracik kad,the office operations if gabut Like material brought to make fishing bait pellets formulated cards
1470,seniman jogja kartu pra kerja skandal jokowi ditipu anak,pre-employment card Jogja artists scandals defrauded child jokowi
1471,kartu pra kerja pekok po mekoki,card pre-employment aite po mekoki
1472,oh iya sbg org yg kerja hrd learning development gak setuju dg,oh yes as org yg learning HRD development work not agree with
1473,ekspansi bansos kartu pra kerja perkirakan masyarakat bantuan mencapai pe,expansion card bansos anticipated pre-work community help achieve the pe
1474,rumahkan menerima bantuan sembako yg rb it,rumahkan receive food assistance that rb it
1475,seniman jogja kartu pra kerja skandal jokowi ditipu anak,pre-employment card Jogja artists scandals defrauded child jokowi
1476,gak modul pelatihan platform t,not training module platform t
1477,lo tolol yg memilih modul pelatihan,lo fool who choose a training module
1478,daftar kartu pra kerja aowkaowk,a list of pre-employment card aowkaowk
1479,selamat malam melati perihal pembukaan rekening bni taplus pra kerja setoran t,Good night jasmine concerning account opening deposit a pre-employment Taplus bni t
1480,utk dokter dgn biaya murah kartu pra,For physicians with low cost pre card
1481,orang yg aktif kerja lolos daftar kartu pra kerja ya,people who actively work to qualify the list of pre-employment card yes
1482,draff ruu nya mba link pendaftaran kartu pra kerja klo link pendaf,Her bill draff mba pre-work card registration link Klo link pendaf
1483,thread by temen temen nggak lolos dapet kartu pra kerja berkecil hati c,thread by friends friends do not qualify for a pre-employment card dapet discouraged c
1484,entitas usaha yg memenuhi,business entities which meet
1485,yg bongkar konspirasi kartu pra kerja negara sdh hutang msh digarong,I unloaded the conspiracy card pre-work state already debt still robber
1486,kartu pra kerja,pre-employment card
1487,setuju sih kartu pra kerja ga dilaunching skrg netizen bener dah pelatihan cv,agree heck pre-employment card ga bener dah netizens launched skrg cv training
1488,seniman jogja kartu pra kerja skandal jokowi ditipu anak,pre-employment card Jogja artists scandals defrauded child jokowi
1489,dipecat kartu pra kerja diliburkan digaji cletuk ayahku yg buru,fired a pre-employment cards were closed salaried cletuk father who rush
1490,saking gedenya kartu pra kerja rp t gabungan penduduk provinsi diy sum,pre-employment saking card gedenya rp t combined population of the province diy sum
1491,saran ahy duit kartu pra kerja dialokasikan bantuan langsung ayo rakyat dukung saran ketu,ahy advice card pre-work money allocated directly help people come bearing advice Ketu
1492,the funny thing is that there are no selection criteria the govt randomly select the peserta which they believe i,the funny thing is that there are no selection criteria the govt randomly select the peserta which they believe i
